name,link,description,investorType,hQLocation,website,investmentAreas,typicalInvestment,fundingStage,linkedin,contactEmail,country
Rockaway Capital,https://www.eu-startups.com/investor/rockaway-capital/,"Multi-stage venture capital firm that builds, creates and invests in outstanding tech companies in CEE & DACH regions.Rockaway is primarily focused on investments in the areas of e-commerce, e-travel, media, fintech and blockchain with operations in the DACH, CEE and Balkans regions.Rockaway’s team of industry experts plays an active role in the firms within the Rockaway portfolio and often gets involved in their day-to-day management.",VC Firm,Czech Republic,http://www.rockawaycapital.com,"Blockchain, Consumer Electronics, Cryptocurrency, E-Commerce, FinTech, Grocery, Media and Entertainment, Price Comparison, Publishing, Travel",Above €3M,Pre-Seed / Seed,https://www.linkedin.com/company/rockaway,[email protected],CZ
N1,https://www.eu-startups.com/investor/n1/,"N1 is a Prague and Luxembourg based venture capital firm.To grow your business you need an investor, however our investment does not mean only money, we become your partners and stay with you through thick and thin.Our motto is to help local companies go global, find a right investor to go global.",VC Firm,Czech Republic,https://n1.rocks/,"Deeptech, Artificial intelligence, Blockchain, Fintech",€100k-€1.5M,Pre-Seed / Seed,https://www.linkedin.com/company/n1ventures,[email protected],CZ
Lighthouse Ventures,https://www.eu-startups.com/investor/lighthouse-ventures-2/,"Lighthouse Ventures benefits from synergies and co-operation with leading Czech startup incubators, tech-partners, universities and governmental institutions for smart cities projects. It also maintains a network of highly skilled and experienced mentors, in benefit of its portfolio companies.An Early-Stage and Acceleration Venture Capital",VC Firm,Czech Republic,https://lhv.vc,"Healthtech, Fintech, SaaS, Deeptech",€100k-€1.5M,Pre-Seed / Seed,https://www.linkedin.com/company/lighthouse-ventures-prague,[email protected],CZ
J&T Ventures,https://www.eu-startups.com/investor/jt-ventures/,"Prague-based VC Fund, investing up to €2.5M in promising European startups.Our strategy is industry agnostic, but we primarily focus on companies in seed stage with proven product market fit. Our average ticket size is between 0.5m EUR - 2.5m EUR",VC Firm,Czech Republic,http://jtventures.cz/en/,"AI, Machine Learning, Enterprise Software",€1.5M-€3M,"Pre-Seed / Seed, Series A/B",https://www.linkedin.com/company/j&t-ventures/,[email protected],CZ
Look AI Ventures,https://www.eu-startups.com/investor/look-ai-ventures/,"Look AI Ventures (LAIV) is the first investment fund in the Czech Republic focusing exclusively on early-stage AI startups,offering new investors high returns and leveraging the AI Startup Incubator's expertise and network.Our team of seasoned managers, entrepreneurs, and technology and AI experts tailors cooperation to the unique needs of every AI startup.",VC Firm,Czech Republic,https://lookai.vc,"Artificial Intelligence (AI), Information Technology, Machine Learning, Software",€100k-€1.5M,Pre-Seed / Seed,https://www.linkedin.com/company/look-ai-ventures,[email protected],CZ
McWin Partners,https://www.eu-startups.com/investor/mcwin-partners/,"McWin is a private investment firm that focuses on Food Tech, Life Science, Clean Tech, Mobility Space Tech, Digitalization, and Fintech.McWin is a private equity ﬁrm founded by Henry McGovern and Steven K. Winegar partnering with exceptional founders and CEOs daring sustainable disruption, principally in the foodservice and food technology sectors.",VC Firm,Czech Republic,https://mcwin.cz/,"Food Service, Food Tech, Life Sciences, FinTech, Mobility, Space Tech, Clean Tech",Above €3M,Series A/B,https://www.linkedin.com/company/mcwinsro,[email protected],CZ
DEPO Ventures,https://www.eu-startups.com/investor/depo-ventures/,"Depo Ventures is an investment group that manages an angel fund, angel network and provides capital advisory services.We manage hands-on DEPO Angel Funds with 25 portfolio companies and the international syndicate of investors, The DEPO Angels. We back rockstar technology founders from the CEE & Baltic regions and facilitate the investment process for business angels.",VC Firm,Czech Republic,https://depoventures.com/,"Blockchain, Crypto, Marketplaces, Deep Tech, EdTech",€100k-€1.5M,Pre-Seed / Seed,https://www.linkedin.com/company/depo-ventures,[email protected],CZ
Soulmates Ventures,https://www.eu-startups.com/investor/soulmates-ventures-2/,"Soulmates Ventures accelerates bold entrepreneurs for a sustainable future, seeking 10 innovative companies in 2024 to fund up to €1,000,000 each for impactful solutions in air, water, energy, mobility, education, healthcare, food & agriculture. We are a green investment fund and innovations accelerator.",Accelerator,Czech Republic,https://www.soulmatesventures.com,"AgTech, CleanTech, EdTech, Energy, GreenTech, Medical, Sustainability, Venture Capital",€100k-€1.5M,"Pre-Seed / Seed, Series A/B",https://www.linkedin.com/company/30652906/,[email protected],CZ
Zásilkovna,https://www.eu-startups.com/investor/zasilkovna/,Zásilkovna is a logistics platform that aims to facilitate the shipping of goods from e-shops to customers.Zásilkovna.cz: Leading Czech logistics tech company with global parcel delivery solutions and trend-setting digital platform.,Corporate VC,Czech Republic,https://www.zasilkovna.cz/en,"Freight Service, Logistics, Shipping, Transportation",€100k-€1.5M,"Pre-Seed / Seed, Series A/B, Series C & Beyond",https://www.linkedin.com/company/z%C3%A1silkovna-s-r-o-/about/,[email protected],CZ
Y Soft Ventures,https://www.eu-startups.com/investor/y-soft-ventures/,"Y Soft Ventures is a VC arm of Y Soft Corporation, investing in people who build innovative B2B hardware & software startups in Central and Eastern Europe. Y Soft Ventures provides invested companies with the necessary capital, resources and expertise to accelerate their path to the global markets. We focus on solutions in the areas of Internet of Things, Cyber Security, Big Data and Augmented & Virtual Reality, with applications in industry, retail, cities and offices.",Corporate VC,Czech Republic,http://www.ysoftventures.com,"B2B tech, Internet of Things, Cyber Security, Big Data, Augmented",€100k-€1.5M,"Pre-Seed / Seed, Series A/B",https://www.linkedin.com/company/y-soft/,[email protected],CZ
Braiins,https://www.eu-startups.com/investor/braiins/,"Braiins offers software solutions for pooled mining and autotuning mining firmware. Braiins is a leading Bitcoin mining company that pioneers the industry with innovative software solutions like Slush Pool, Braiins OS+, and Stratum V2. They provide tools and services for miners, offering pool, farm proxy, firmware and data insights. Bitcoin mining ecosystem. Mine more bitcoin with Braiins mining tools: mining pool, management system, custom firmware, hardware, education & more.",Corporate VC,Czech Republic,https://braiins.com,"IT, Blockchain, Software, Bitcoin, Embedded, Cryptocurrency",€100k-€1.5M,"Pre-Seed / Seed, Series A/B, Series C & Beyond",https://www.linkedin.com/company/braiins,[email protected],CZ
Soulmates Ventures,https://www.eu-startups.com/investor/soulmates-ventures/,"Environmental problems are growing much faster than solutions and only bold, future-oriented, world-changing, and even crazy sounding innovations have the power to reverse the unfortunate future of our society or our place on this planet. Our mission is to save our future on this planet by accelerating bold green innovations.",Corporate VC,Czech Republic,https://www.soulmatesventures.com,"AgTech, CleanTech, EdTech, Energy, GreenTech, Medical",€100k-€1.5M,"Pre-Seed / Seed, Series A/B, Series C & Beyond",https://www.linkedin.com/company/30652906/,[email protected],CZ
Principal Engineering,https://www.eu-startups.com/investor/principal-engineering/,"Principal Engineering is an IT firm that provides solutions, software development, IT services, consultancy, and outsourcing services.Principal engineering s.r.o. offers top IT services and business solutions in Europe and North America, partnering with clients to drive innovation and growth through software development, IT consulting, and project management.",Corporate VC,Czech Republic,https://www.principal.cz/en/,"Information Technology, Software, Software Engineering",€100k-€1.5M,"Pre-Seed / Seed, Series A/B, Series C & Beyond",https://www.linkedin.com/company/principal-engineering/about/,[email protected],CZ
Frame100r,https://www.eu-startups.com/investor/frame100r/,"Frame100r is a production company that provides TV, feature-film, commercials production, and motion graphics services.Frame100r is a group of highly skilled, creative, and production professionals with experience in both domestic and international projects.",Corporate VC,Czech Republic,http://www.frame100r.com/en/,"Film Production, Motion Capture, TV Production",€100k-€1.5M,"Pre-Seed / Seed, Series A/B",https://www.linkedin.com/in/pavel-zverina-90246616,[email protected],CZ
TopMonks Startup Studio,https://www.eu-startups.com/investor/topmonks-startup-studio/,Startup investment arm of TopMonks.TopMonks is a software development partner experienced in both startup and corporate environments. They provide sharp coding teams for technical execution of ideas in exchange for stakes in startups.,Corporate VC,Czech Republic,https://studio.topmonks.com/,"Financial Services, Venture Capital, Consulting, Blockchain, Fintech",€100k-€1.5M,"Pre-Seed / Seed, Series A/B",https://www.linkedin.com/company/topmonks/,[email protected],CZ
Pilulka Lab,https://www.eu-startups.com/investor/pilulka-lab/,"Pilulka Lab is a business acceleration and ventures funding company focused on investing in startups operating in the e-health industry. Pilulka is one of the leading European e-commerce companies changing the old habit of buying medicines and associated products. Time can be spent more valuably. With a huge product catalogue, a wide range of innovative services and professional customer care we aim to offer an excellent consumer experience in all five markets we operate today.",Accelerator,Czech Republic,https://www.pilulkalab.com/,"Finance, Health Care, Medical, Venture Capital",0-€100k,Pre-Seed / Seed,https://www.linkedin.com/company/dr-pilulka-s-r-o-/,[email protected],CZ
StartupYard,https://www.eu-startups.com/investor/startupyard/,"StartupYard is a seed accelerator that focuses on deep tech startups. Established in 2011, StartupYard is the oldest private accelerator in the CEE region. So far StartupYard has invested in and accelerated 9 cohorts of 65 startups. Its aim is to help startups grow and gain further investment, while connecting them with partners and mentors to help them launch on the global stage.",VC Firm,Czech Republic,http://startupyard.com/,"Blockchain, Consulting, Cyber Security, Finance, Information Technology",0-€100k,Pre-Seed / Seed,http://www.linkedin.com/company/startupyard,[email protected],CZ
Lighthouse Ventures,https://www.eu-startups.com/investor/lighthouse-ventures/,"Lighthouse Ventures is an early-stage and acceleration venture capital firm, focused on technology projects with predilection to the Czech market. Our mission in Lighthouse Ventures is to nurture inspiring ideas throughout their critical early stage, financially as well as professionally.",Accelerator,Czech Republic,https://lhv.vc,"Venture Capital, Private Equity Principals, Financing, Funding",0-€100k,Pre-Seed / Seed,https://www.linkedin.com/company/lighthouse-ventures-prague,[email protected],CZ
PowerHUB,https://www.eu-startups.com/investor/powerhub/,"PowerHUB is research organization that concentrates on transfer of technologies in mobility, energy, and ICT for industry. PowerHUB is a technology transfer organisation focused on innovation and research. Since 2017, we have sought to make the world more sustainable, equitable, and connected by helping big ideas become a reality.",Accelerator,Czech Republic,http://powerhub.cz/,"Energy, Information, Communications Technology (ICT), Project Management",0-€100k,Pre-Seed / Seed,https://www.linkedin.com/company/powerhubprague/,[email protected],CZ
Venture Club,https://www.eu-startups.com/investor/venture-club-2/,"Venture Club is a private club for investors interested in commonly unavailable investment opportunities and projects and business plans. They are engaged in searching for and selecting suitable projects for investment. They organize investment, educational and social events. They operate an online investment platform for",Accelerator,Czech Republic,https://www.ventureclub.cz/,"Investments, Projects, Investing, Consulting, Social events",0-€100k,Pre-Seed / Seed,https://www.linkedin.com/company/venture-club-z-s,[email protected],CZ
Venture Club,https://www.eu-startups.com/investor/venture-club/,"Venture Club is a private club for investors interested in commonly unavailable investment opportunities and projects and business plans.They are engaged in searching for and selecting suitable projects for investment. They organize investment, educational and social events. They operate an online investment platform for",VC Firm,Czech Republic,https://www.ventureclub.cz/,"Investments, Projects, Investing, Consulting, Social events",0-€100k,Pre-Seed / Seed,https://www.linkedin.com/company/venture-club-z-s,[email protected],CZ
JIC STARCUBE,https://www.eu-startups.com/investor/jic-starcube/,"International accelerator for startups in the fields IoT and ICT Security. We support entrepreneurs and foster the development of an innovation ecosystem. We are based in #brnoregion in the heart of Europe, in the Czech Republic. Our founders are the South Moravian Region, the Statutory City of Brno, Masaryk University, Brno University of Technology, Mendel University in Brno, and the University of Veterinary and Pharmaceutical Sciences in Brno.",Accelerator,Czech Republic,https://www.jic.cz,"Information, Consulting, Entrepreneurship, Internet Services",0-€100k,Pre-Seed / Seed,https://www.linkedin.com/company/south-moravian-innovation-centre,[email protected],CZ
ITACA Business Incubator,https://www.eu-startups.com/investor/itaca-business-incubator/,"ITACA Business Incubator is a prague-based business incubator for early-stage startups from CEE region. Business incubator ITACA - it's the whole ecosystem, aimed to work with investors, to find best startups and to help them to grow. We created an experts community in order to evaluate risks and the right perspective of projects we deal with.",Accelerator,Czech Republic,http://itaca.cz,"Venture Capital, Financial Services, Lending, Investments",0-€100k,Pre-Seed / Seed,https://www.linkedin.com/company/itaca-business-incubator,[email protected],CZ
Creative Dock,https://www.eu-startups.com/investor/creative-dock/,"Creative Dock is is a professional company builder and early stage investor from Prague. Over the last decade, we have grown from a disruptive startup into the world's largest independent corporate venture builder. We are one of the leaders of a growing young category called Company Venture Building (CVB), helping large companies find and bring in new revenue by creating new services and products that positively impact society.",Accelerator,Czech Republic,https://creativedock.com/,"Digital services, Execution, Corporate Venture Building, Digital Ventures",0-€100k,Pre-Seed / Seed,https://www.linkedin.com/company/2920299/,[email protected],CZ
i&i Prague,https://www.eu-startups.com/investor/ii-prague/,"i&i Prague is a bio-innovation center partner for biotech innovations and smart money investments. i&i Prague, s.r.o. is a technology transfer organization that is scouting and supporting the growth of the most promising projects from academic institutions from Central Europe to pass through the riskiest part of the journey to market. Furthermore, financial support provided by i&i Prague should significantly increase the attractiveness and value of a project for further licensees or investors.",Accelerator,Czech Republic,https://www.iniprague.com,"Biotechnology, Investor, Biotech incubator, Medical Science, Technology Transfer",0-€100k,Pre-Seed / Seed,https://www.linkedin.com/company/iniprague,[email protected],CZ
BUDETO,https://www.eu-startups.com/investor/budeto/,"A unique studio generating ideas, setting up teams with vetted founders, and financing the first few months to get ready for VC investment. BUDETO is a unique startup studio concept where the studio generates ideas, sets up the founding team with vetted and balanced founders, and finances the first few months to create a company with a demo or initial traction that is ready to be invested in by a VC fund.",Accelerator,Czech Republic,http://budeto.xyz/,"Technology, Information, Internet, Finance",0-€100k,Pre-Seed / Seed,https://www.linkedin.com/company/budeto/,[email protected],CZ
AI Startup Incubator,https://www.eu-startups.com/investor/ai-startup-incubator/,"AI Startup Incubator (AISI) is part of Look AI Ventures, an early-stage investment fund focusing exclusively on AI startups. Our mission is to empower ambitious teams to realize their business goals and utilize the power of AI. At AISI, we do not believe in a one-size-fits-all approach. Instead, we tailor cooperation to the needs of every startup and offer our portfolio companies both business and technical/AI expertise in addition to the investment.",Accelerator,Czech Republic,https://www.suincubator.ai/,"Artificial Intelligence, Machine Learning, Incubator, Deep Learning",0-€100k,Pre-Seed / Seed,https://www.linkedin.com/company/18162430/,[email protected],CZ
Biometric Ventures,https://www.eu-startups.com/investor/biometric-ventures/,"Biometric Ventures is a venture capital company based in Prague focused on early-stage startups in biometrics. The company was established in 2020 as an internal innovation platform of Innovatrics, a global leader in biometric technology. Our investment approach is a combination of pre-seed financial investment, mentoring, and access to unique biometric technologies of our parent company Innovatrics.",Accelerator,Czech Republic,https://www.biometric-ventures.com/,"Biometrics, Early-stage startups, Pre-seed investments, Seed investments",0-€100k,Pre-Seed / Seed,https://www.linkedin.com/company/biometric-ventures/,[email protected],CZ