name,link,description,investorType,hQLocation,website,investmentAreas,typicalInvestment,fundingStage,linkedin,contactEmail,country
Olisipo Way,https://www.eu-startups.com/investor/olisipo-way/,"Olisipo Way is an Early Stage Venture Firm focused on IT investments. Our investments are varied in terms of business areas but we have a natural tendency for B2B projects. We speak the same language as entrepreneurs, the language of business. More than investors, we are also entrepreneurs. Our priority is the choice of the right people and the creation of a community that works as a plus in the lives of our startups.",VC Firm,Portugal,https://olisipoway.com/home,"Adtech, AI, Food Delivery, Food Tech, Transportation",€100k-€1.5M,Pre-Seed / Seed,https://www.linkedin.com/company/olisipoway/,[email protected],PT
Faber VC,https://www.eu-startups.com/investor/faber-vc/,"We invest in teams transforming the world with technology. Faber is a Lisbon-based venture capital firm investing in outstanding entrepreneurs who innovate at the intersection of science and technology to drive digital transformation and climate action. The firm combines a specialist focus on deep tech early stage startups with dedicated funds, investment teams, and expert advisors to actively help founders build global companies powered by AI/data or climate/ocean technologies. Faber’s unique approach in Southern Europe is led by an entrepreneurial management partnership and backed by notable thesis-driven institutions and private investors. Investing since 2013, the firm has been an early investor in hard tech companies such as Unbabel, SWORD Health, Codacy, iLoF, Smartex or YData.",VC Firm,Portugal,https://faber.vc/,"AI/Data, Climate/Ocean Tech and Web3",€100k-€1.5M,Pre-Seed / Seed,https://www.linkedin.com/company/faber-vc/,[email protected],PT
COREangels EnterpriseTech,https://www.eu-startups.com/investor/coreangels-enterprisetech/,"First international VC specialized in Total Experience, focused on disruptive solutions for Customer or Talent acquistion, retention and engagement. We invest in Europe & USA",VC Firm,Portugal,https://www.coreangels.com/angel-groups/enterprisetech,SaaS B2B Adtech MarTech HRTech,€100k-€1.5M,Pre-Seed / Seed,https://www.linkedin.com/company/coreangels-enterprisetech,[email protected],PT
3XP Global,https://www.eu-startups.com/investor/3xp-global/,"3XP Global is an Asset Management firm that aggregates a unique track record in terms of ESG Integration in the Investment Process and Active Role by supporting founders during the all life of the investments cycle. Sustainability Best Practices for Sustainable Investments are our Ethos! Being the first financial company as a B Corp in Portugal, 3xP Global has the 17 United Nations SDG’s (Sustainable Development Goals) as key core values, sustained by the idea that along with sustainability comes return. We are UN PRI signatories and follow the GRI Standards Reporting. 3XP Global invests in companies whose sustainable trends and practices create real value for investors while contributing to a more Sustainable EARTH. Regulated and supervised by Portuguese Securities Market Commission (CMVM), 3XP Global ensures full Transparency, Integrity and Independence. We are fully committed to lead all investments to increase companies' sustainability levels into business models. Therefore, 3XP Global provides the leading platform Grow Sustainable connecting founders to international markets, from Europe to Asia and America.",VC Firm,Portugal,https://www.3xpglobal.eu/,"Impact Investments; Health and Life Sciences, ESG",€100k-€1.5M,"Pre-Seed / Seed, Series A/B",https://www.linkedin.com/company/3xpglobal/about/,[email protected],PT
Massar International,https://www.eu-startups.com/investor/massar-international/,"Massar Associates, the predecessor organization of Massar International, was founded by Palestinian businessman Bashar Masri in 1994 as a vehicle to promote sustainable economic development in Palestine. Massar is an Arabic word meaning ""path"". The name symbolizes the vision of its founder to create a company which would successfully link the very best of local professionalism in Palestine with international best practices and an understanding of Western management perspectives in order to integrate the Palestinian economy fully into the global economy.",Corporate VC,Portugal,http://www.massar.com,"Association, Government, Non Profit, Investment Management, Financial, Real State",€100k-€1.5M,"Pre-Seed / Seed, Series A/B, Series C & Beyond",https://www.linkedin.com/company/massar-international,[email protected],PT
PROEF,https://www.eu-startups.com/investor/proef/,"Proef develops integrated solutions for the IT, Telecom, Power, Cities and Corporate sectors.Proef is a company that develops integrated solutions in a turnkey model for the Telecom, Power, Cities, and Corporate sectors. They aim to drive and lead change in the industry by working closely with customers, partners, and employees",Corporate VC,Portugal,https://proef.com/en,"Electricity, Telecommunications, IT, Renewable Energy, IoT",€100k-€1.5M,"Pre-Seed / Seed, Series A/B",https://www.linkedin.com/company/proefgroup,[email protected],PT
Bright Pixel,https://www.eu-startups.com/investor/bright-pixel/,"Former Sonae IM, Bright Pixel Capital is a venture capital company with a global aim, financially driven and oriented to make businesses prosper. We have the power of transformational change across our DNA sectors: Cybersecurity, Retail Technologies, Digital Infrastructure and Emerging Technologies. Envisioned as the tech investment arm of Sonae Group, a Portuguese multinational with a diversified portfolio of innovative brands, Bright Pixel Capital has invested over 250M€ in the first 5 years in more than 50 direct investments, and will continue this path using our expertise to spot unique opportunities with the potential to change an industry.",Corporate VC,Portugal,https://brpx.com/,"Cloud Infrastructure, Cyber Security, Financial Services, IT Infrastructure, Telecommunications, Venture Capital",€100k-€1.5M,"Pre-Seed / Seed, Series A/B",https://www.linkedin.com/company/brightpixelcapital/,[email protected],PT
Startup Braga,https://www.eu-startups.com/investor/startup-braga/,"At Startup Braga we know that success is only possible with work and the right tools, so our mission is to provide entrepreneurs with the support and knowledge they need to achieve their goals. In partnership with Microsoft, Startup Braga is a leading innovation hub, designed to assist the inception and development of high potential entrepreneurial projects for international markets. We provide business pre-acceleration, acceleration, and incubation programs, as well as facilitated access to investment sources, for startups with global ambitions.",Accelerator,Portugal,http://startupbraga.com/,"Sustainability, Accelerator, Incubator, Investment Management, Digital",0-€100k,Pre-Seed / Seed,https://www.linkedin.com/company/startup-braga,[email protected],PT
Startup Lisboa,https://www.eu-startups.com/investor/startup-lisboa/,"Startup Lisboa mentorship-driven pre-seed to series A stage incubator for tech startups. Startup Lisboa is an incubation program based in downtown Lisbon with work and residence spaces to welcome startups from all over the world. Founded in 2012 by the Lisbon Municipality, Montepio Bank and IAPMEI, it's a private non-profit association that provides physical and virtual incubation.",Accelerator,Portugal,http://www.startuplisboa.com,"Financing, Incubation, Coaching, Mentoring",0-€100k,Pre-Seed / Seed,https://www.linkedin.com/company/startup-lisboa,[email protected],PT
Startup Lighthouse,https://www.eu-startups.com/investor/startup-lighthouse/,"Startup Lighthouse is committed to developing cross border connections within and beyond Europe. The project lights the way for startups within Europe by organising 8 Deep Dive Weeks in 4 ecosystems, meeting over 1,600 different ecosystem players in specific themes and culminating with a Lighthouse Award each year. Startup Lighthouse is a Startup Europe initiative.",Accelerator,Portugal,http://startuplighthouse.eu,"Technology, Information, Internet services, Blockchain, Healthcare",0-€100k,Pre-Seed / Seed,https://www.linkedin.com/company/startup-lighthouse/,[email protected],PT
Startup Leiria,https://www.eu-startups.com/investor/startup-leiria/,"Startup Leiria is an incubator and accelerator with more than 150 startups in the ecossystem. We are a technological innovation network that offers several services and projects to support all types of innovation. Startup Leiria is an entrepreneurial ecosystem that has transformed the entrepreneurial landscape of Leiria, Portugal.",VC Firm,Portugal,https://www.startupleiria.com/,"Business Development, Management Consulting, IT Services, Professional Services",0-€100k,Pre-Seed / Seed,https://www.linkedin.com/company/startup-leiria,[email protected],PT
Startup LAB,https://www.eu-startups.com/investor/startup-lab/,"Startup LAB is an acceleration program includes training in legal, intellectual property, branding and marketing. Our program is designed to meet the specific needs of each startup. We provide a structured framework to guide your progress and help you achieve your goals, while our market-oriented and validation-driven approach, combined with our community support, can help startups succeed in today’s rapidly evolving market.",Accelerator,Portugal,https://www.startuplab.pt/,"Entrepreneurs, Financial Services, Finance, Mentoring",0-€100k,Pre-Seed / Seed,,[email protected],PT
Poolside Accelerator,https://www.eu-startups.com/investor/poolside-accelerator/,"Poolside Accelerator supports and accelerates the development of decentralized technology ventures. Our mission is to become the leading platform to support innovators and progressive ideas, funded by the community. To create a world where value provided by the many, outweighs the influence of the few.",Accelerator,Portugal,https://www.poolside.co/poolside-accelerator,"Finance, Financial Services, Web3, Blockchain, Gaming",0-€100k,Pre-Seed / Seed,https://www.linkedin.com/company/poolsideco/,[email protected],PT
SURFnCODE,https://www.eu-startups.com/investor/surfncode/,Product Studio. Early stage product strategy & acceleration. SURFnCODE is a builder of products and companies. We partner with hand-picked founders of early-stage companies whose missions we believe in to create new products and scale teams into standalone businesses. We are hands-on co-founders that care about the details.,VC Firm,Portugal,http://www.surfncode.io,"Product, Venture, AI, Deep Tech",0-€100k,Pre-Seed / Seed,https://www.linkedin.com/company/surfncode,[email protected],PT
Protechting,https://www.eu-startups.com/investor/protechting/,"This intensive program is looking for new solutions worldwide in Healthtech and Insurtech, always guaranteeing that the global innovation process is sustainable and collaborative. Protecting is a dynamic open innovation program jointly led by Fosun, Fidelidade, Hospital da Luz Learning Health, and powered by Fábrica de Startups.",Accelerator,Portugal,http://www.protechting.pt/,"Insurtech, Heakthtec, Innovation, Mentoring",0-€100k,Pre-Seed / Seed,https://www.linkedin.com/in/cmsilva,[email protected],PT
Fabrica de Startups,https://www.eu-startups.com/investor/fabrica-de-startups/,"Fabrica de Startups is a business accelerator that aims to create new startups in Portugal. Our mission is to help people to become successful entrepreneurs. Using our methodology we help them identifying business ideas, creating teams, designing their business model, finding customers and in the launching of the company.",Accelerator,Portugal,http://www.fabricadestartups.com/,"Venture Capital, Private Equity Principals, Financial Services, Lending, Investments",0-€100k,Pre-Seed / Seed,http://www.linkedin.com/company/2675826,[email protected],PT
Venture Catalysts,https://www.eu-startups.com/investor/venture-catalysts-3/,"Venture Catalysts is a company focused on commercialization of technologies through entrepreneurship. By supporting visionary researchers and entrepreneurs releasing the full potential of their technologies, the company acts as a catalyst on the development of new technology–based ventures",VC Firm,Portugal,http://www.venture-catalysts.com,"Advanced Materials, Biotechnology, Genetics, Hardware, Nanotechnology",0-€100k,Pre-Seed / Seed,http://www.linkedin.com/company/venture-catalysts,[email protected],PT
EDP Energy Starter,https://www.eu-startups.com/investor/edpstarter/,"Energy Starter is an open innovation program created by EDP to accelerate the energy transition worldwide by co-innovating impactful solutions with startups and scaleups. Structured into three parallel tracks, the program deep-dives into key areas of the energy sector: Future Grids, Renewable Energy & Green Hydrogen, and Client Solutions.",Accelerator,Portugal,https://theenergystarter.com/,"Future Grids, Renewable Energy & Green Hydrogen, and Client Solutions",€100k-€1.5M,Series A/B,https://www.linkedin.com/company/edp/,[email protected],PT
Discoveries,https://www.eu-startups.com/investor/discoveries/,"An intensive four-week acceleration program in Lisbon that will turn fresh ideas into successful businesses crafted to empower high-potential Startups while promoting innovative tourism ventures on a global scale. Through bootcamps, workshops and mentorship we drive market integration and investment attraction. Empower small businesses with Digital Solutions for SMEs.",Accelerator,Portugal,http://www.startupdiscoveries.com,"Venture Capital, Private Equity, Principals, Entrepreneurs",0-€100k,Pre-Seed / Seed,https://www.linkedin.com/company/fabricadestartups/about/,[email protected],PT
KickUP Sports Innovation,https://www.eu-startups.com/investor/kickup-sports-innovation/,"Sports innovation platform to support the next generation of sports entrepreneurs and enthusiasts. We are the sports innovation tifosi! More than flags, banners and drums, we support you with passion and hands-on experience. KICKUP Sports Innovation wants to capitalize on the rapidly shifting sports landscape while tapping on opportunities to accelerate technological innovations, ideas and products. We want to bring the sports industry to another level and contribute to improve athletes performance, fan engagement and sports clubs efficiency and operations.",Accelerator,Portugal,http://kickupsports.eu/,"Innovation, Spectator Sports, Sports Entrepreneurs, Enthusiasts",0-€100k,Pre-Seed / Seed,https://www.linkedin.com/company/11030977,[email protected],PT
From Start-to-Table,https://www.eu-startups.com/investor/from-start-to-table/,"The foodtech ecosystem isn't just about food. From Start-to-Table is an acceleration program for innovative startups focused on tech solutions for the F&B and restaurant sectors, sustainable F&B products and future food concepts. Bringing innovation to the restaurant ecosystem.",Accelerator,Portugal,https://www.fromstart-to-table.com/,"Innovation, Startups, Tecnology, F&B, Restaurant Ecosystem",0-€100k,Pre-Seed / Seed,https://www.linkedin.com/company/fromstart-to-table/,[email protected],PT
Venture Catalysts,https://www.eu-startups.com/investor/venture-catalysts-2/,"Venture Catalysts is a company focused on commercialization of technologies through entrepreneurship. By supporting visionary researchers and entrepreneurs releasing the full potential of their technologies, the company acts as a catalyst on the development of new technology–based ventures",VC Firm,Portugal,http://www.venture-catalysts.com,"Advanced Materials, Biotechnology, Genetics, Hardware, Nanotechnology",0-€100k,Pre-Seed / Seed,http://www.linkedin.com/company/venture-catalysts,[email protected],PT
Gotbit,https://www.eu-startups.com/investor/gotbit/,"Gotbit provides a platform-based solution, bringing back control of the markets to the founders of the project. Gotbit was founded in 2017, when BTC was just a $1000. We lived through the ICO boom, blockchain regulation and Binance launch. In the time since we went from two traders to a big company, spanning multiple branches of the crypto market.",Accelerator,Portugal,https://gotbit.io/,"Trading, Software Development, Cryptocurrency, Blockchain, AI",0-€100k,Pre-Seed / Seed,https://www.linkedin.com/company/gotbit/about/,[email protected],PT
Grow,https://www.eu-startups.com/investor/grow/,"Grow by Jose de Mello - The perfect ecosystem to develop your startup. Grow connects startups with our companies in win-win partnerships. Through access to our infrastructure and people, startups have the opportunity to test their solutions in the real market and accelerate their businesses. At the same time, José de Mello gets first-hand access to new ideas and challenges to its business models.",Accelerator,Portugal,http://grow.josedemello.pt,"Health, Mobility, Industry, Senior Homecare, Wine",0-€100k,Pre-Seed / Seed,https://www.linkedin.com/company/growjosedemello/,[email protected],PT
Build Up Labs,https://www.eu-startups.com/investor/build-up-labs/,"A Startup Studio and Incubator helping startups launch and grow in a more efficient way. Build Up Labs is a startup studio that ideates, builds, and grows several startups in parallel, based on a lean process. By creating new ventures, from ideation to business models, from UX to development, from growth hacking to social media management, we generate and validate digital product ideas.",Accelerator,Portugal,https://builduplabs.com/,"Software Development, Venture Builder, Innovation, Mobile Apps, Social Apps",0-€100k,Pre-Seed / Seed,https://www.linkedin.com/company/build-up-labs/,[email protected],PT
Building Global Innovators,https://www.eu-startups.com/investor/building-global-innovators/,"Building Global Innovators is a tech-based accelerator for ventures with a deep technological component (Health Tech, Enterprise IT, etc). BGI is a startup accelerator, born in 2010 from a partnership between MIT Portugal (MIT Portugal Entrepreneurship and Innovation Initiative) and ISCTE. Over the past decade, our flagship accelerator program, BGI Accelerator, has helped over 160 startups from 76 countries raise over €300 million.",Accelerator,Portugal,https://www.bgi.pt,"Business Consulting, Business Service, Financial service, FinTech",0-€100k,Pre-Seed / Seed,https://www.linkedin.com/company/bgiaccelerator/,[email protected],PT
Amorim Cork Ventures,https://www.eu-startups.com/investor/amorim-cork-ventures-2/,"Amorim Cork Ventures has been established with the purpose of supporting entrepreneurs launch their projects. Amorim Cork Ventures has been established in 2014 with the purpose of supporting entrepreneurs and startups launch their projects and businesses while exploring innovative products and applications for cork. This Corticeira Amorim company's main purpose is to promote the development and expansion of new cork products and cork-related businesses, mainly targeted to foreign markets.",Accelerator,Portugal,http://www.amorimcorkventures.com,"Entrepreneurs, Investment, Innovation, Innovative Products",0-€100k,Pre-Seed / Seed,,[email protected],PT
ASTROPRENEURS Space Startup Accelerator,https://www.eu-startups.com/investor/astropreneurs-space-startup-accelerator/,"ASTROPRENEURS Space Startup Accelerator turns space-related ideas into viable businesses, promoting opportunities for entrepreneurs. Astropreneurs Accelerator is a three-month acceleration program that includes business and technical mentorship, support to fund your business idea and access to our “SPACE Economy “Astropreneurs” network”. Space Startup Accelerator.",Accelerator,Portugal,https://astropreneurs.eu/,"Space, Accelerator, Aerospace, Research, Entrepreneurship",0-€100k,Pre-Seed / Seed,https://www.linkedin.com/company/astropreneursh2020/,[email protected],PT
Beta-Start,https://www.eu-startups.com/investor/beta-start/,"The Beta-start is an acceleration program for entrepreneurs that want to create and develop their startups. We are a collaborative innovation consultancy with a global reach. For more than 12 years we have been the partner of choice for world-class companies to accelerate their innovation journey. We’re experts on managing corporate and open innovation, and on designing impactful strategies, products and services alongside in-company teams.",Accelerator,Portugal,https://beta-i.com/,"Innovation, Entrepreneurship, Consulting, Acceleration",0-€100k,Pre-Seed / Seed,https://www.linkedin.com/company/betai/,[email protected],PT
Blue Bio Value,https://www.eu-startups.com/investor/blue-bio-value/,"Blue Bio Value is an accelerator that scales up marine biobased solutions to global market applications in different industries. Ideas as powerful as the ocean - The world needs your sustainable solutions, now more than ever. Blue Bio Value is an international business acceleration and ideation programme based in Portugal dedicated to the blue bioeconomy, and we want you to be a part of it.",Accelerator,Portugal,https://www.bluebiovalue.pt/,"Biotechnology, Tech, Marine biology, Technology, Sustainability",0-€100k,Pre-Seed / Seed,https://www.linkedin.com/company/blue-bio-value/,[email protected],PT
Lince Capital,https://www.eu-startups.com/investor/lince-capital-2/,"Lince Capital is dedicated to creating value for investment fund subscribers through innovative and professional asset management. They operate across diverse sectors including real estate, healthcare, technology, and more, supporting SMEs and startups with high growth potential. Lince Capital offers services like venture capital funding, subsidiary management, feasibility studies, and financial model validation, backed by a network of trusted contacts and strategic partnerships.",Corporate VC,Portugal,https://www.lince-capital.com/,"Sector agnostic, positive impact",€1.5M-€3M,Series C & Beyond,https://www.linkedin.com/company/lince-capital/,[email protected],PT
Bynd Venture Capital,https://www.eu-startups.com/investor/bynd-venture-capital/,"Bynd is an Iberian Venture Capital firm established in 2010, focusing on seed and early-stage technology companies with a connection to Iberia. With over 50 investments across various verticals and geographies, Bynd emphasizes sustainable profitability, non-negotiable integrity, and responsible commitment. Their entrepreneurial approach supports entrepreneurs' development and growth goals, creating a positive ecosystem impact.",VC Firm,Portugal,https://bynd.vc/,IT/Digital and Sustainability,€100k-€1.5M,Pre-Seed / Seed,https://www.linkedin.com/company/bynd-venture-capital,[email protected],PT
Iberis Capital,https://www.eu-startups.com/investor/iberis-capital/,"Iberis Capital is a private equity and venture capital manager in Portugal, founded in 2017, focusing on innovation, growth, and yielding investments. With over €570 million in assets under management and more than 1200 investors, Iberis emphasizes interest alignment, a high-performance team, and full independence and compliance.",VC Firm,Portugal,https://iberiscapital.com/,industry and technology,0-€100k,Pre-Seed / Seed,https://www.linkedin.com/company/iberis-capital/,[email protected],PT
MSM,https://www.eu-startups.com/investor/msm/,"MSM is an impact Venture Capital fund that invests in the great businesses of the future, those that solve social and environmental challenges. MSM targets fast-growing European ventures with global lock-step potential where impact and financial returns are mutually reinforcing",VC Firm,Portugal,https://msm.vc/,"Impact, sustainability, social good",€100k-€1.5M,Pre-Seed / Seed,https://www.linkedin.com/company/msmfund/,[email protected],PT
HCapital Partners,https://www.eu-startups.com/investor/hcapital-partners/,"HCapital focuses its VC investment activity on small and medium-sized enterprises (SMEs) with a high technological nature, featuring innovative and scalable global business models, and presenting high growth potential.",VC Firm,Portugal,https://hcapital.pt/,"Energy, Telecommunications, mobility, logistics, industrial operations and delivery",€1.5M-€3M,Series A/B,https://www.linkedin.com/company/hcapital-partners/,[email protected],PT
Caixa Capital,https://www.eu-startups.com/investor/caixa-capital/,Caixa Capital invests across all sectors with a focus on information technology and is a Portuguese private equity and venture capital firm.,VC Firm,Portugal,http://www.caixacapital.pt,"Finance, Financial Services, Venture Capital",€1.5M-€3M,Series A/B,https://www.linkedin.com/company/5098339?trk=tyah&trkInfo=clickedVertical%3Acompany%2CclickedEntityId%3A5098339%2Cidx%3A2-2-3%2CtarId%3A1442308324415%2Ctas%3Acaixa%20capital,[email protected],PT
Bright Ventures,https://www.eu-startups.com/investor/bright-ventures/,"Bright Ventures is the investment arm of Bright Pixel, focusing on tech companies with a particular emphasis on B2B in the retail, telco, and cyber-security sectors. They invest in various stages of development, from early (MVP) to growth stages, and possible Post-seed and Series A follow-ons. Their investment management team and committee bring years of proven experience in building, selling companies, and managing global tech-based investment funds.",VC Firm,Portugal,https://brpx.com/bright-ventures/,"Cybersecurity, retail technologies and infrastructure software",0-€100k,Pre-Seed / Seed,https://www.linkedin.com/company/brpx-bright-pixel,[email protected],PT
