name,link,description,investorType,hQLocation,website,investmentAreas,typicalInvestment,fundingStage,linkedin,contactEmail,country
Volvo Cars Tech Fund,https://www.eu-startups.com/investor/volvo-cars-tech-fund/,We aim to build and nurture a portfolio of high-potential startups in the mobility space that can scale and become our closest partners to help us create better and more competitive products and services.,Corporate VC,Sweden,https://www.volvocars.com/intl/v/tech-fund/,"Mobility, IoT, Computer Vision, VR/XR, Automotive",€1.5M-€3M,Series A/B,https://www.linkedin.com/company/volvocars/about/,[email protected],SE
STOAF,https://www.eu-startups.com/investor/stoaf/,"STOAF, is an early stage VC fund, registered as an AIF under the EuVECA framework. Started in 2008, STOAF is now operating its third fund, STOAF III SciTech. The focus is on early stage investments in sustainable research based spin-outs within deep tech and life sciences.",VC Firm,Sweden,https://stoaf.se/,"Sustainable Energy Technologies, Advanced ICT, Advanced Industrial Technologies, Life Sciences",Above €3M,Series C & Beyond,https://www.linkedin.com/company/stockholms-aff-rs-nglar-ab/,[email protected],SE
Oxx Ventures,https://www.eu-startups.com/investor/oxx-ventures/,"Oxx partners with the most promising European B2B software companies at the scale-up stage. As a specialist SaaS investor, Oxx provides each entrepreneur with a support system of unique specialist expertise and network, and a culture of unfaltering partnership and absolute conviction. The firm’s strategy is built around the concept of “Go-To-Market Fit”, developing a structure for thinking about how to build a repeatable, sustainable growth engine that accelerates and propels the growth of SaaS companies. Oxx was founded by Richard Anton and Mikael Johnsson in 2017 and is headquartered in London and Stockholm.",VC Firm,Sweden,https://www.oxx.vc/,"AI, Cybersecurity, HRtech, Martech, B2B, SaaS, Climate",€1.5M-€3M,Series A/B,https://www.linkedin.com/company/oxx-vc/,[email protected],SE
Goose Valley Ventures,https://www.eu-startups.com/investor/goose-valley-ventures/,"Investing in Nordic FinTech & Impact stars. Goose Valley is invested in some of the leading FinTechs in the Nordics: Klarna, Lunar, Open Payments, Receipt Hero, Indo. The name Goose Valley comes from the U-shaped valley Lapporten, a symbol of Sweden and its magnificent nature. In Northern Sami it is called Čuonjávággi which translates into Goose Valley.",VC Firm,Sweden,https://goosevalley.vc/,"Fintech, Payments, Digital Banking, Lending, Insurtech",€100k-€1.5M,Pre-Seed / Seed,https://www.linkedin.com/company/goose-valley-ventures/,[email protected],SE
eEquity,https://www.eu-startups.com/investor/eequity/,"eEquity is a sector-focused fund, investing in the intersection between technology and retail including companies with physical products, digital services and software. We actively invest in the digital space, having led 40 platform investments deploying over EUR 420 million. Our preference is to invest as the first institutional investor. Our investments range from EUR 5-20 million per company. Typically, we take large minority ownership stakes and dedicate substantial time and resources to guide, support and nurture our portfolio companies.",VC Firm,Sweden,https://www.eequity.se/,"Consumer Brand, Reseller, Technology",€1.5M-€3M,Pre-Seed / Seed,https://www.linkedin.com/company/eequity/,[email protected],SE
D-Ax Corporate Venture Capital,https://www.eu-startups.com/investor/d-ax-corporate-venture-capital/,"D-Ax is a partnership between Axel Johnson, a Swedish retail conglomerate and RECAPEX, a Nordic Investment company. Axel Johnson’s aim with D-ax is to invest in digital entrepreneurial companies. The ambition is to increase the trading group’s digital resources. As one of the Nordic region’s leading trading groups, Axel Johnson aims to meet with customers across all contact channels and develop new digital offers. The ambition is to is to increase the trading group’s digital resources. The firm looking for entrepreneurial digital companies that do business in trading and services. The companies should have achieved a certain level of sales and have a proven business model. While they may be e-commerce companies, this is not a must; they might also be companies that work with other digital business ideas within the spectrum covering online marketing, data transparency and data analysis.",Corporate VC,Sweden,http://www.d-ax.se,"Finance, Financial Services, Venture Capital",€100k-€1.5M,"Pre-Seed / Seed, Series A/B, Series C & Beyond",https://www.linkedin.com/company/d-ax/,[email protected],SE
BillerudKorsnäs Venture,https://www.eu-startups.com/investor/billerudkorsnas-venture/,BillerudKorsnäs Venture invests in startups that will define tomorrow’s packaging solutions. We look for companies with financially and environmentally sustainable packaging products and services and a dedicated team. BillerudKorsnäs Venture is a wholly owned subsidiary of BillerudKorsnäs.,Corporate VC,Sweden,https://www.billerudkorsnas.com,"Packaging Services, Paper Manufacturing, Venture Capital",€100k-€1.5M,"Pre-Seed / Seed, Series A/B, Series C & Beyond",https://www.linkedin.com/company/billerudkorsn-s-ab,[email protected],SE
Collector Ventures,https://www.eu-startups.com/investor/collector-ventures/,"Collector Ventures is the investment vehicle of of Collector Bank, founded by Lena Apler.Collector Bank is a digital niche bank providing personal loans, credit cards, savings accounts, e-commerce payment solutions, factoring, and corporate lending with a strong emphasis on innovation and entrepreneurship.",Corporate VC,Sweden,https://www.collector.se/,"Financial Services, Sustainability, Complaint, Data protection",€100k-€1.5M,"Pre-Seed / Seed, Series A/B, Series C & Beyond",https://www.linkedin.com/company/collector,[email protected],SE
Telia Ventures,https://www.eu-startups.com/investor/telia-ventures/,"Telia Ventures invests in consumer and enterprise markets focusing on cloud, mobile, and security. Telia Ventures looks for companies with the capability to become leaders in their segments. They invest in Series A and B rounds and their geographical focus is Northern Europe and other selected innovation hubs. Telia Ventures is the venture capital arm of Telia Company.",Corporate VC,Sweden,https://www.teliacompany.com/en/about-the-company/our-operations/telia-ventures/,"Business Development, Consumer, Enterprise, Financial Services, Venture Capital",€100k-€1.5M,"Pre-Seed / Seed, Series A/B",https://linkedin.com/company/teliacompany,[email protected],SE
Bonnier Ventures,https://www.eu-startups.com/investor/bonnier-ventures/,"Launched as Bonnier Growth Media in 2013, Bonnier Ventures is the venture arm of media group Bonnier. As a financially driven corporate venture investor, they make minority investments in fast growing digital technology companies across multiple growth stages. Bonnier Capital is the investment division of the Bonnier Group, a Swedish based family owned group within media, publishing and real estate. The Bonnier Group has partnered with entrepreneurs for almost 200 years to enable innovation and the fostering of ideas and new businesses.",Corporate VC,Sweden,http://www.bonnierventures.com,"Digital Media, Finance, Financial Services, Venture Capital, Investment",€100k-€1.5M,"Pre-Seed / Seed, Series A/B, Series C & Beyond",https://www.linkedin.com/company/11392105/,[email protected],SE
MobilityXlab,https://www.eu-startups.com/investor/mobilityxlab/,"MobilityXlab offers startups and emerging companies with pioneering ideas within mobility and connectivity the opportunity to accelerate with our six corporate partners: Ericsson, Magna, Polestar, Volvo Group, Zeekr Technology Europe and Zenseact. By offering a dedicated contact person to guide and access the partners competence, networks, tools and insights from leading subject matter experts, as well as workspace, we want to open the doors for companies ready to take on this challenge together with us. Together we will bring the future of mobility closer.",Corporate VC,Sweden,https://www.mobilityxlab.com/en,"Research Services, Automotive, Mobility, Connectivity, Artificial Intelligence",0-€100k,Pre-Seed / Seed,https://www.linkedin.com/company/mobilityxlab/,[email protected],SE
Husqvarna Ventures,https://www.eu-startups.com/investor/husqvarna-ventures/,"Husqvarna Ventures is an corporate venture capital arm of Husqvarna Group.Husqvarna Group is a global leader in outdoor power products, garden watering products, and cutting equipment. Their range includes robotic lawnmowers, chainsaws, trimmers, and garden irrigation systems, all driven by a passion for innovation.",Corporate VC,Sweden,https://www.husqvarnagroup.com/,"Innovative outdoor power products, Garden watering products, Cutting equipment, Industries, Robotic Automowers",€100k-€1.5M,"Pre-Seed / Seed, Series A/B",https://linkedin.com/company/husqvarna,[email protected],SE
AxSol,https://www.eu-startups.com/investor/axsol/,"AxSol makes investments in eminent businesses in the distributed energy industry. AxSol, the group's newest member, seeks to finance and support disruptive companies engaged in the solar energy industry.",Corporate VC,Sweden,http://www.axsol.se,"Finance, Renewable Energy, Investment, Innoavtion",€100k-€1.5M,"Pre-Seed / Seed, Series A/B, Series C & Beyond",https://www.linkedin.com/company/axsolab,[email protected],SE
PINC,https://www.eu-startups.com/investor/pinc/,"PINC was launched as Paulig Incubator in 2018 to help Paulig stay in the forefront of relevant innovations, as well as to contribute to a tastier, healthier and more sustainable planet. Today, our ambition is the same, but we have developed into a corporate venture arm. We aim for strategic, financial, and societal impact in our investments, fostering a sustainable food system for tomorrow. We are looking for entrepreneurs in an attractive market space with an intrinsic drive to find a solution to the problem they are addressing, a clear and scalable plan for success, a reliable team and partners whom we can trust and work closely with.",Corporate VC,Sweden,https://www.pauliggroup.com/pinc/,"Investing, Foodtech, Futurefood, Sustainability",€100k-€1.5M,"Pre-Seed / Seed, Series A/B, Series C & Beyond",https://www.linkedin.com/company/pinc-paulig-incubator/?originalSubdomain=se,[email protected],SE
H&M Group Ventures,https://www.eu-startups.com/investor/hm-group-ventures/,"H&M Group Ventures is the venture capital arm of the H&M Group. Founded in 1947, H&M Group is a global design company with ~4,702 stores in 76 markets and 56 online markets. At H&M Group, we believe in making great design available to everyone. It’s essential in everything we do. Our family of brands and business ventures offer customers around the world a wealth of fashion, beauty, accessories and homeware, as well as modern menus with fresh and local produce at some of the brands’ in-store eateries.",Corporate VC,Sweden,https://hmgroupventures.com/,"Fashion, Design, Retail, Supply chain, Sustainability",€100k-€1.5M,"Pre-Seed / Seed, Series A/B, Series C & Beyond",https://www.linkedin.com/company/hmgroup/,[email protected],SE
Volvo Group Venture Capital,https://www.eu-startups.com/investor/volvo-group-venture-capital/,"Volvo Group Venture Capital is a corporate investment company making venture capital and growth equity investments. Their mission is to drive new business growth and their ambition is to be a leading corporate investor in sustainable transport and infrastructure solutions. Their value proposition to the companies we invest in, other investors as well as to our Volvo colleagues, is to accelerate growth.",Corporate VC,Sweden,http://www.volvogroup.com/venturecapital,"Finance, Venture Capital, Trucks, Construction Equipment, Buses",€100k-€1.5M,"Pre-Seed / Seed, Series A/B, Series C & Beyond",https://www.linkedin.com/company/volvo-group/,[email protected],SE
Pophouse Ventures,https://www.eu-startups.com/investor/pophouse-ventures/,"Pophouse Ventures is the venture capital arm of Pophouse Entertainment.Pophouse Entertainment is a pioneering company that invests in intellectual property and develops entertainment brands in music, live entertainment, podcast, gaming, and hospitality.",Corporate VC,Sweden,https://pophouse.se/,"Live entertainment, Gaming, Hospitality, Music, Podcasts",€100k-€1.5M,"Pre-Seed / Seed, Series A/B, Series C & Beyond",https://www.linkedin.com/company/pophouseent/,[email protected],SE
SSE Ventures,https://www.eu-startups.com/investor/sse-ventures/,"The early-stage venture capital firm of the Stockholm School of Economics. SSE Ventures is the early-stage venture capital fund of SSE Business Lab and the Stockholm School of Economics. The fund invests in startups admitted to the Incubate program, where they receive coaching, office space and access to a wide range of investors, partners and relevant expertise.",Accelerator,Sweden,https://ssebl.com/ventures,"E-Commerce, Financial Services, Information Technology, Internet, Software",0-€100k,Pre-Seed / Seed,https://www.linkedin.com/company/88376172/,[email protected],SE
SmiLe Incubator,https://www.eu-startups.com/investor/smile-incubator/,"SmiLe Incubator helps entrepreneurs and startup companies to develop and commercialize new ideas. Surrounded by smart and passionate people, as well as the best tools and approaches at your disposal – you’ll take leaps toward creating a business and connecting with the right people and resources. We offer business coaching, access to investor & industry networks, access to labs & instrument as well as a community with colleagues, friends and peers.",Accelerator,Sweden,http://www.smileincubator.life/,"Biotechnology, Life science, Medtech, Healthtech, Pharma",0-€100k,Pre-Seed / Seed,https://www.linkedin.com/company/smile-incubator/,[email protected],SE
Norrsken Accelerator,https://www.eu-startups.com/investor/norrsken-accelerator/,"Norrsken Accelerator is an Accelerator program. Norrsken supports founders with the knowledge, network and capital they need to make saving the world their business. We operate award-winning Norrsken House hubs in Stockholm, Sweden, Barcelona, Spain and Kigali, Rwanda.",Accelerator,Sweden,https://accelerator.norrsken.org,"Civic, Social Organizations, Entrepreneurs, Non-profit",0-€100k,Pre-Seed / Seed,https://www.linkedin.com/company/norrsken-foundation/,[email protected],SE
Norrkoping Science Park,https://www.eu-startups.com/investor/norrkoping-science-park/,"Norrkoping Science Park enables entrepreneurship and innovation for sustainable growth. We create waves of growth, competitiveness, and attractiveness in Norrköping with entrepreneurship, research-driven solutions, and societal impact at heart. Creating Positive Change.",Accelerator,Sweden,http://www.nosp.se/,"Matching, Education, Communication, Visualization, Printed electronics",0-€100k,Pre-Seed / Seed,https://www.linkedin.com/company/norrk-ping-science-park-ab,[email protected],SE
Nicoya,https://www.eu-startups.com/investor/nicoya-2/,"Nicoya is a business-accelerating investment company focusing on foodtech. A foodtech investment company driven by creating meaningful impact on people, planet & health. Business-accelerating investment company focused on food tech, relentlessly driven by creating meaningful impact for people, planet & health. Nicoya is set on step-changing the future of foods.",Accelerator,Sweden,https://www.nicoya.se/,"Foodtech, Investment, Impact investing, Growth, Consumer Insights",0-€100k,Pre-Seed / Seed,https://www.linkedin.com/company/nicoya-ab/about/,[email protected],SE
Sting,https://www.eu-startups.com/investor/sting/,"Sting enables talented people to turn their ideas into sustainable businesses. Sting enables talented people to turn their ideas into sustainable businesses. The support we offer includes qualified coaching in business development, a business angel network, a venture capital fund, a recruitment service, and an international network of investors, business contacts and experts.",VC Firm,Sweden,http://www.sting.co,"Sting enables talented people to turn their ideas into sustainable businesses. Sting enables talented people to turn their ideas into sustainable businesses. The support we offer includes qualified coaching in business development, a business angel network, a venture capital fund, a recruitment service, and an international network of investors, business contacts and experts.",0-€100k,Pre-Seed / Seed,http://www.linkedin.com/company/108052,[email protected],SE
Unboxx,https://www.eu-startups.com/investor/unboxx/,"Unboxx operates as a business lab dedicated to fostering creativity and growth in startups. We provide a dynamic environment for entrepreneurs to develop, test, and refine their ideas. At Unboxx, we empower visionary businesses to reach their full potential through strategic support and collaboration.",VC Firm,Sweden,https://www.unboxx.se/,"Business Consulting, Services, Incubation, Advertising",0-€100k,Pre-Seed / Seed,https://www.linkedin.com/company/unboxx,[email protected],SE
SUP46,https://www.eu-startups.com/investor/sup46/,"Startup Hub providing its members with competitive advantage through the world-class ecosystem. Also open meeting place for the community. For over a decade, we have been inspiring, educating, and empowering founders, providing them with a network and resources to supercharge their growth and improve the startup ecosystem. Our milestones speak to our shared ambition. Over 300 startups have grown through our ranks, raising a staggering +$1Bn in venture capital. With 25+ exits & IPOs, we're just getting started.",VC Firm,Sweden,http://SUP46.com,"Events, Internet, Meeting Software, Mobile",0-€100k,Pre-Seed / Seed,http://www.linkedin.com/company/3307676,[email protected],SE
Eureka Partners,https://www.eu-startups.com/investor/eureka-partners/,"Eureka Partners promotes an open-minded and innovative culture, challenging established ideas and seeking fresh solutions. Eureka Partners is a Web3.0 advisory, incubation and investment firm that guide startup projects, SMEs and MNCs to the crypto world. Our team comes from a diverse background including investment banking, venture capital, management consulting and successful Web3.0 entrepreneurship and working experiences.",Accelerator,Sweden,https://www.eurekapartners.xyz,"Business Consulting, Services Industry, Consulting, Professional Services",0-€100k,Pre-Seed / Seed,https://www.linkedin.com/company/eurekapartners,[email protected],SE
Fast Track Malmo,https://www.eu-startups.com/investor/fast-track-malmo/,"Helping amazing teams accelerate their growth and raise their first VC round. We invest a €50k in 10 different startups a year. Based in Malmö, Southern Sweden, our accelerator has been voted the best accelerator program in Sweden and is one of the highest quality accelerator programs in Europe. Fast Track Malmö offers a 3-month program including €50k of investment as a convertible note.",Accelerator,Sweden,http://www.fasttrackmalmo.com/,"Entrepreneurship, Ecosystem building, Mentoring, Venture capital",0-€100k,Pre-Seed / Seed,https://www.linkedin.com/company/10249566,[email protected],SE
LEVELS – The Venture Studio,https://www.eu-startups.com/investor/levels-the-venture-studio/,"Levels venture studio builds excellent ideas into successful businesses by co-founding, investing, and sharing both risk and upside. Levels is a Nordic venture studio that creates, builds, and invests in brilliant digital businesses with an offering that covers all aspects of digital transformation. Founded in 2016 with a vision to develop unique and differentiated products, services, and ventures based on cutting-edge tech, Levels continuously shares risk and upside with clients and partners while delivering innovation, long-term value creation and impact.",Accelerator,Sweden,https://www.wearelevels.com/,"Consulting, Marketing, Software, Web Design, Web Development",0-€100k,Pre-Seed / Seed,https://www.linkedin.com/company/wearelevels/,[email protected],SE
Uppsala Innovation Centre,https://www.eu-startups.com/investor/uppsala-innovation-centre/,The company offers well-defined processes to help startups develop their innovations. Its mission is to increase the number of successful high-growth companies within the Uppsala region.,VC Firm,Sweden,http://www.uic.se,"Professional Training, Coaching, Business Development, Network, Management Support",0-€100k,Pre-Seed / Seed,https://www.linkedin.com/company/uic-uppsala_innovation_centre/,[email protected],SE
LEAD,https://www.eu-startups.com/investor/lead/,LEAD our objective is to accelerate the development of start-ups by providing idea bringers and entrepreneurs. We have tools for success when you need to build companies in tech - from startups to growth companies. LEAD is a business incubator that has supported hundreds of promising startups in Östergötland.,Accelerator,Sweden,http://lead.se/,"Entrepreneurship, Start-ups, Business Development, Lean, Proffessional Coaching",0-€100k,Pre-Seed / Seed,https://www.linkedin.com/company/9552263,[email protected],SE
DigitalWell Ventures,https://www.eu-startups.com/investor/digitalwell-ventures/,"DigitalWell Ventures is an accelerator firm that invests in digital health tech and welfare companies. Accelerator for Nordic and Baltic Health Tech Startups / Startup Program Developer for Innovation Ecosystem Actors. We develop founder oriented accelerator programs supporting our startup teams with company building, preparing to raise capital by raising their investor readiness and accelerate their network and market traction for scaling and growth.",Accelerator,Sweden,https://digitalwellventures.com,"Accelerator, Investor, Innovation, Health Tech, Finance",0-€100k,Pre-Seed / Seed,https://www.linkedin.com/company/dwa-ventures,[email protected],SE
Krinova,https://www.eu-startups.com/investor/krinova/,"Krinova, an incubator and science park, offers meeting spaces, arranges tailor-made conferences, and promotes innovations and development. Krinova helps to build a thriving business climate, a Sweden of the future where entrepreneurs realise ideas and reach their full potential. Krinova´s profile area is food. We strive to be a strong voice for innovation and entreprenurship in the food sector in Sweden and in the Nordic region.",Accelerator,Sweden,https://www.krinova.se/,"Food, Innovation, Sustainability, Development, Incubator",0-€100k,Pre-Seed / Seed,https://me.linkedin.com/company/krinova-science-park,[email protected],SE
Yuncture Invest,https://www.eu-startups.com/investor/yuncture-invest/,"Our platform facilitates meaningful connections, mentorship, and investment opportunities to empower startups for sustainable growth. At Yuncture Invest, we foster collaboration and innovation, bridging the gap between visionaries and resources essential for entrepreneurial success",VC Firm,Sweden,https://yuncture.com/,"Entrepreneurship, Financing, Marketing, Finance, Accounting",0-€100k,Pre-Seed / Seed,https://www.linkedin.com/company/yuncture/,[email protected],SE
Framtidens Foretag,https://www.eu-startups.com/investor/framtidens-foretag/,"Framtidens Foretag(Future Enterprises) is a business incubator. We are Founders Loft, an incubator that supports and promotes entrepreneurship with a sustainable focus in the Västra Götaland region. By providing business development and knowledge development activities for companies both established and newly started. Founders Loft develops startup companies into sustainable growth companies in digital services.",Accelerator,Sweden,https://www.foundersloft.se/,"Saas startups, Business incubator, Realizing ideas, Entrepreneurs, Coaching",0-€100k,Pre-Seed / Seed,https://www.linkedin.com/company/founders-loft/,[email protected],SE
WhaleShark,https://www.eu-startups.com/investor/whaleshark/,"weXelerate is an Europe's smartest startup & innovation hub.fostering cutting-edge ideas and collaboration. We provide startups with access to mentorship, resources, and a vibrant ecosystem to accelerate growth. At weXelerate, we cultivate innovation and drive forward-thinking solutions that shape the future of various industries.",VC Firm,Sweden,https://www.whaleshark.eu/,"Investment Management, Crowdfunding, Insurance, Financial Services",0-€100k,Pre-Seed / Seed,https://www.linkedin.com/company/whale-shark-ab/,[email protected],SE
Walerud Ventures,https://www.eu-startups.com/investor/walerud-ventures-2/,"Wincanton is a leading third party logistics (3PL) and supply chain solutions provider in the UK and Ireland. We work in industry sectors as diverse as defence, milk, energy, retail, consumer goods and construction, supporting customers at every stage of their development. Whether they are a small niche retailer, a growing brand",VC Firm,Sweden,http://www.walerud.com,"Advanced Materials, Artificial Intelligence (AI), Biotechnology, CleanTech, GreenTech",0-€100k,Pre-Seed / Seed,,[email protected],SE
Hatchbay,https://www.eu-startups.com/investor/hatchbay/,"We remove early stage obstacles by providing a tech team, funding and business advice from successful entrepreneurs. We empower you to build something people really want and then help you get alot of people to use your service. All startups take part in our 6 month program where we co-build your product.",VC Firm,Sweden,https://www.hatchbay.co,"Venture Capital, Private Equity Principals, Funding",0-€100k,Pre-Seed / Seed,https://www.linkedin.com/company/hatchbayco/,[email protected],SE
