name,link,description,investorType,hQLocation,website,investmentAreas,typicalInvestment,fundingStage,linkedin,contactEmail,country
Gullspång Invest,https://www.eu-startups.com/investor/gullspang-invest/,"Gullspång Invest funds entrepreneurial teams addressing global challenges with commercial solutions, aiming to transform systems into more resilient states. They prioritize true value over exits and plan with a long-term perspective, focusing on the next generation rather than short-term gains. Purpose-driven and profit-oriented, they seek enduring partnerships with entrepreneurs who share their passion. Their investment portfolio includes companies such as Mat.se, Oatly, N!CK’S, Färsking, Baseload Capital, Climeon, Trine, Vilokan, and Axis Communications.",VC Firm,Sweden,https://gullspang.vc/#1,"Sustainability, Food, Energy, Renewables",Above €3M,Series C & Beyond,https://www.linkedin.com/company/gullspangvc/,[email protected],SE
Nineyards Equity,https://www.eu-startups.com/investor/nineyards-equity/,"The investor focuses on scaling tech-enabled and consumer internet companies from Series A and beyond, investing between EUR 2-15 million initially. They prioritize ""more mature tech companies"" with over EUR 5 million in revenue or ARR, strong annual growth, profitability, and a resilient, scalable business model. Emphasizing market leadership and additional growth potential, they seek teams with proven capabilities and a commitment to positive ESG impacts for superior financial returns.",VC Firm,Sweden,https://www.nineyardsequity.com/,"EV, Fintech, Logistics, Blockchain, Data, Cybersecurity",€1.5M-€3M,Series A/B,https://www.linkedin.com/company/nineyards-equity,[email protected],SE
Curitas Ventures,https://www.eu-startups.com/investor/curitas-ventures/,"Curitas Ventures is a Stockholm based VC, launched by Mikael Ahlström and Gerda Larsson in 2020. We invest in teams determined to build something out of the ordinary within the field of Disruptive Tech and Life Science.",VC Firm,Sweden,https://www.curitasventures.com/,"Disruptive Technology, Life Science and Sustainability.",€100k-€1.5M,Pre-Seed / Seed,https://www.linkedin.com/company/curitasventures/,[email protected],SE
Webrock Ventures,https://www.eu-startups.com/investor/webrock-ventures/,"Webrock Ventures operates as a Venture Studio specializing in creating tech companies through a unique venture-building approach. Their mission centers on developing digital enterprises that positively impact the daily lives of Brazilians. By partnering with leading technology firms in the Nordic region, they integrate proven business models with funding capabilities and operational expertise. This collaboration enables their portfolio companies to gain a significant advantage, accelerating value creation while mitigating risks. As active owners, they prioritize delivering both shareholder and social value, emphasizing the establishment of sustainable, long-term businesses. Founded in 2018, Webrock Ventures is headquartered in Stockholm, Sweden, and São Paulo, Brazil.",VC Firm,Sweden,http://webrockventures.com/,"Healthtech, Fintech, Medtech, Marketplaces",€100k-€1.5M,Pre-Seed / Seed,https://www.linkedin.com/company/webrock-ventures/,[email protected],SE
DHS Venture Partners,https://www.eu-startups.com/investor/dhs-venture-partners/,"To DHS we bring decades of experience in entrepreneurship. Between our partners and alumni, we have founded and built companies with an accumulated valuation of >15 billion sek, held board seats at companies such as Altor, Kinnevik, Nasdaq, and invested in >120 companies across industries.",VC Firm,Sweden,http://www.dhsventurepartners.com/,"Software, Big Data, SaaS, ML, Ecommerce",€100k-€1.5M,Pre-Seed / Seed,https://www.linkedin.com/company/dhs-venture-partners,[email protected],SE
Axilium Holding,https://www.eu-startups.com/investor/axilium-holding/,"Axilium Holding was established in Gothenburg, Sweden in 2018. Empowered with significant investment experience in several fields, a wide professional network, and a strong desire to succeed, the two founders established an innovative investment company focusing on early stage Technology and Life Science companies based predominantly in Europe.",VC Firm,Sweden,https://www.axiliumholding.com/,"Life Sciences, Semiconductor, Biotech, Software, MedTech",€100k-€1.5M,Pre-Seed / Seed,https://www.linkedin.com/company/axilium-holding/about/,[email protected],SE
East Hill Equity,https://www.eu-startups.com/investor/east-hill-equity/,"Scania Growth Capital is the hybrid venture capital fund powered by Scania and managed by East Hill Equity. East Hill Equity is an experienced start-up investor with years of experience in different industries, who firmly believes that the relationship with their founders is the key asset. With offices in Stockholm and Berlin, East Hill Equity works with a flexible and fair investment approach on a long term basis, supporting companies during their growth.",VC Firm,Sweden,https://easthillequity.com,"B2B, Intelligent Automation, Photonics, AI, Microchips",€1.5M-€3M,Series A/B,https://www.linkedin.com/company/east-hill-equity-ab,[email protected],SE
Mist Ventures,https://www.eu-startups.com/investor/mist-ventures/,"Mist Ventures specializes in investing in technology-driven companies, particularly those in deep tech sectors with proprietary technology that offers a competitive edge. Their focus areas include embedded software, hardware, ASIC, telecom, machine learning, and algorithms, where they leverage strong technological and industry expertise. With investments up to 1M SEK, Mist Ventures actively engages with portfolio companies to maximize their benefit from the team's experience. They target scalable technology ventures in the pre-seed and seed stages, aiming for significant international market opportunities. Their investments prioritize businesses with sustainable long-term potential built on future-proof technologies.",VC Firm,Sweden,https://www.mistventures.com/,"Deep Tech, embedded software, hardware, ASIC, telecom, machine learning, and algorithms",€100k-€1.5M,Pre-Seed / Seed,https://www.linkedin.com/company/mist-ventures/?originalSubdomain=in,[email protected],SE
LRF Ventures,https://www.eu-startups.com/investor/lrf-ventures/,"LRF Ventures, operated by the Federation of Swedish Farmers (LRF), is dedicated to fostering innovation within the agricultural and forestry sectors in Sweden. They believe that innovative startups with smart, sustainable solutions can significantly contribute to growth and profitability in Swedish agriculture. LRF Ventures emphasizes the importance of a robust agricultural system as foundational to building a sustainable society for the future.",VC Firm,Sweden,https://www.lrfventures.se/,"Sustainability, Food Tech, Green Tech",€1.5M-€3M,Pre-Seed / Seed,https://www.linkedin.com/company/lrf-ventures,[email protected],SE
Course Corrected,https://www.eu-startups.com/investor/course-corrected/,"Course Corrected is a stage agnostic fund with a primary focus on seed stages and Series A rounds, with potential to invest selectively in later stages in special opportunities. Course Corrected is backing outstanding entrepreneurs and teams with fast growing and scalable businesses that drive the transformation towards climate positive alternatives, disrupting incumbents and with the potential to become leaders in their respective markets.",VC Firm,Sweden,https://cc.vc,"Pet Food, Alternative Proteins, Green Hydrogen, Sustainability, Impact Investing",€100k-€1.5M,Pre-Seed / Seed,https://www.linkedin.com/company/course-corrected/,[email protected],SE
Proptech Farm,https://www.eu-startups.com/investor/proptech-farm/,"PropTech Farm accelerates startups in PropTech and Real Estate, focusing on SaaS, Data & AI, IoT, Sustainable Energy, and Transaction tech. They invest in Nordic and Southeast Asian companies with global growth potential, guiding founders and teams with coaching and network access.",VC Firm,Sweden,https://www.proptechfarm.com/,"Property, Tech, and PropTech, SaaS, Data, AI",€100k-€1.5M,Pre-Seed / Seed,https://www.linkedin.com/company/proptechfarm/?originalSubdomain=se,[email protected],SE
Partnerinvest Norr,https://www.eu-startups.com/investor/partnerinvest-norr/,"Partnerinvest Norr is a venture capital firm operating in Norr- and Västerbotten, established in 2010 through Norrlandsfonden and Almi Invest. They specialize in investing in companies with scalable business models and driven entrepreneurs across diverse industries. Unlike typical venture capital firms, Partnerinvest Norr focuses on northern Sweden and collaborates with private investment partners to provide substantial capital and extensive networks. Their Investment Managers bring extensive regional industry knowledge and experience in equity capital investments.",VC Firm,Sweden,http://www.partnerinvestnorr.se,"Software, Healthtech, Biotech, Cybersecurity",€100k-€1.5M,Pre-Seed / Seed,https://www.linkedin.com/company/partnerinvest-norr,[email protected],SE
The Case for Her,https://www.eu-startups.com/investor/the-case-for-her/,"The Case for Her is a global blended-finance investment portfolio addressing the key women’s health issues of menstruation and female sexual health through grants, investments, convenings, and advocacy. Founded in 2017, The Case for Her brings together over 30 years of experience working and investing in women’s health and rights. This dynamic and flexible portfolio spans the globe and includes investments in product companies, tech innovations, research initiatives, and grassroots organizations.",VC Firm,Sweden,https://thecaseforher.com/,"Femtech, Reproductive Health , Impact Investing, SexTech",€100k-€1.5M,Pre-Seed / Seed,https://www.linkedin.com/company/the-case-for-her,[email protected],SE
RYMD Kapital,https://www.eu-startups.com/investor/rymd-kapital/,"Rymdkapital is a pioneering venture capital firm based in Sweden, specializing in Spacetech investments across the Nordics and Europe. They focus on supporting visionary entrepreneurs tackling commercial needs and global challenges within the expanding space economy. With extensive experience in both space industry dynamics and early-stage investing, Rymdkapital aims to accelerate startup growth from initial funding to later stages, leveraging their deep industry insights and strategic connections.",VC Firm,Sweden,https://rymdkapital.se/,"Satellite Systems, Space Communications, Propulsion Systems, Space Tech",€100k-€1.5M,Series A/B,https://www.linkedin.com/company/rymdkapital/,[email protected],SE
Talent Venture Group,https://www.eu-startups.com/investor/talent-venture-group/,"Talent Venture Group (TVG) is a rapidly expanding investor and venture builder in the HR and Talent Tech sector, focused on empowering founders to create innovative companies that enhance talent management. They bring specialized knowledge across recruitment, engagement, and performance to drive sustainable impact in HR practices. With ambitions to lead globally in their field, TVG has already invested in over 20 HR and Talent Tech startups, achieving 6 successful exits. Their current portfolio includes diverse companies like Talent Inc, Nova, NyTeknik, and others, positioning TVG as a key player in shaping the future of HR technology.",VC Firm,Sweden,https://www.talentventuregroup.com/,"HR Tech, Talent Tech, Recruitment",€100k-€1.5M,Pre-Seed / Seed,https://www.linkedin.com/company/talent-venture-group/,[email protected],SE
LIU Invest,https://www.eu-startups.com/investor/liu-invest/,"LiU Invest invests in companies oriented toward commercializing ideas and results connected to Linköping University. This means we contribute to innovative companies in ways that bring added values to the University as well as in strengthening the attractiveness of the region. LiU Invest is part of LiU Holding AB, owned by Linköping University. An important part of LiU Holding’s mission is to, at an early stage, make investments in research associated companies. This is done by LiU Invest.",VC Firm,Sweden,http://www.liuinvest.se/,"University spin-outs, deeptech",0-€100k,Pre-Seed / Seed,https://www.linkedin.com/company/liuinvest/,[email protected],SE
RightBridge Ventures,https://www.eu-startups.com/investor/rightbridge-ventures/,"Their mission is to accelerate sustainable growth in gaming and esports, aiming to make global wealth accessible to all stakeholders: investors, players, fans, and companies. Their objectives include contributing to the global expansion of the esports and gaming industries, maximizing sustainable returns on investment in their portfolio companies, promoting fairness in wealth distribution across the industry's value chain, and advocating for gender equality within esports.",VC Firm,Sweden,https://rightbridge.se/,"Esports, Gaming, NFT, Games Studios",€100k-€1.5M,Pre-Seed / Seed,https://www.linkedin.com/company/rightbridge-ventures/,[email protected],SE
Kale United,https://www.eu-startups.com/investor/kale-united/,They are a public holding company focused on impact investments in pioneering plant-based and foodtech companies. Their investments are diversified and aimed at scalable R&D and production. Kale United's holdings are designed to accelerate the shift to a more plant-based lifestyle and reduce the carbon footprint of food.,Corporate VC,Sweden,http://kaleunited.com/,"Foodtech, Alternative proteins, Supply Chain, Pet Food, Agtech",0-€100k,Pre-Seed / Seed,https://www.linkedin.com/company/kaleunited/,[email protected],SE
Creandum,https://www.eu-startups.com/investor/creandum-3/,"Creandum, founded after the dotcom bubble and having thrived through the 2008/9 economic crisis, continues to invest steadily despite recent market conditions, believing top founders can emerge anytime. They've witnessed significant growth in the European tech market over 20 years. Now, they proudly announce the closing of Creandum VII, a €500m fund to support Europe's top Seed and Series A startups. Their disciplined, generalist approach focuses on partnering with the best entrepreneurs to build future global, category-defining companies.",VC Firm,Sweden,http://www.creandum.com,"Marketplaces, Delivery services, Edtech, Healthtech",€1.5M-€3M,Series A/B,http://www.linkedin.com/company/creandum,[email protected],SE
Creandum,https://www.eu-startups.com/investor/creandum-2/,"Creandum, founded after the dotcom bubble and having thrived through the 2008/9 economic crisis, continues to invest steadily despite recent market conditions, believing top founders can emerge anytime. They've witnessed significant growth in the European tech market over 20 years. Now, they proudly announce the closing of Creandum VII, a €500m fund to support Europe's top Seed and Series A startups. Their disciplined, generalist approach focuses on partnering with the best entrepreneurs to build future global, category-defining companies.",VC Firm,Sweden,http://www.creandum.com,"Marketplaces, Delivery services, Edtech, Healthtech",€1.5M-€3M,Series A/B,http://www.linkedin.com/company/creandum,[email protected],SE
Norrsken VC,https://www.eu-startups.com/investor/norrsken-vc-2/,"Founded in Sweden in 2017 by four impact capitalists, Norrsken VC is the venture capital arm of the non-profit Norrsken Foundation, aiming to channel more capital to entrepreneurs building impactful businesses. With a pragmatic, results-driven approach, Norrsken VC supports the top 1% of startups in the impact space, including an increasing number of Unicorns, contributing to worldwide impact.",VC Firm,Sweden,https://www.norrsken.vc/,Impact,€100k-€1.5M,Series A/B,https://www.linkedin.com/company/norrskenvc/,[email protected],SE
Norrsken VC,https://www.eu-startups.com/investor/norrsken-vc/,"Founded in Sweden in 2017 by four impact capitalists, Norrsken VC is the venture capital arm of the non-profit Norrsken Foundation, aiming to channel more capital to entrepreneurs building impactful businesses. With a pragmatic, results-driven approach, Norrsken VC supports the top 1% of startups in the impact space, including an increasing number of Unicorns, contributing to worldwide impact.",VC Firm,Sweden,https://www.norrsken.vc/,Impact,€100k-€1.5M,Series A/B,https://www.linkedin.com/company/norrskenvc/,[email protected],SE
Kinnevik,https://www.eu-startups.com/investor/kinnevik/,"They are on a mission to redefine industries and create new categories. As an entrepreneurial investor, active owner, and operational partner, they support challenger companies in Europe and the US. With a permanent capital structure, they invest to rapidly scale future market leaders in healthcare, software, marketplaces, and climate tech. They back ideas, founders, and companies that simplify everyday life globally. They invest in products and services that offer better choices and solutions to pressing issues. Committed to creating long-term value, they engage at all stages of a company’s growth journey.",VC Firm,Sweden,http://www.kinnevik.com,"Healthcare, software, marketplaces and climate tech.",Above €3M,Series C & Beyond,https://www.linkedin.com/company-beta/2710452,[email protected],SE
Creandum,https://www.eu-startups.com/investor/creandum/,"Creandum, founded after the dotcom bubble and having thrived through the 2008/9 economic crisis, continues to invest steadily despite recent market conditions, believing top founders can emerge anytime. They've witnessed significant growth in the European tech market over 20 years. Now, they proudly announce the closing of Creandum VII, a €500m fund to support Europe's top Seed and Series A startups. Their disciplined, generalist approach focuses on partnering with the best entrepreneurs to build future global, category-defining companies.",VC Firm,Sweden,http://www.creandum.com,"Marketplaces, Delivery services, Edtech, Healthtech",€1.5M-€3M,Series A/B,http://www.linkedin.com/company/creandum,[email protected],SE
Luminar Ventures,https://www.eu-startups.com/investor/luminar-ventures/,"Luminar is the most active pre-seed and seed-stage VC fund in Sweden. Their focus now extends globally as they seek out future-forward technologies and business models, supporting top-tier founders primarily in the Nordic region.",VC Firm,Sweden,https://www.luminarventures.com/,"Gaming, Healthtech, AI, Software, Logistics",€100k-€1.5M,Pre-Seed / Seed,https://www.linkedin.com/company/18387339/,[email protected],SE
Chalmers Ventures AB,https://www.eu-startups.com/investor/chalmers-ventures-ab/,"They are a prominent deep tech investor and venture builder in the Nordics, specializing in commercializing innovations from research labs. Their unique model integrates venture creation and tech investments, leveraging Chalmers’ entrepreneurial ecosystem to identify and nurture high-potential deep tech opportunities with commercial and societal impact. They actively start and support companies based on cutting-edge research, playing a pivotal role from investment through to exit. Profits are reinvested to sustain their evergreen model, funding further groundbreaking research at Chalmers University.",VC Firm,Sweden,http://www.chalmersventures.com/,Deep tech,€100k-€1.5M,Series A/B,https://www.linkedin.com/company/chalmers-ventures,[email protected],SE
J12,https://www.eu-startups.com/investor/j12/,"They support entrepreneurs who are developing solutions for the AI era, focusing on founders creating technically sophisticated data and AI tools, as well as AI-native applications. Above all, they prioritize founders who demonstrate exceptional creativity, insatiable curiosity, and unwavering determination to succeed.",VC Firm,Sweden,https://www.j12ventures.com/,"AI, Software, Data",€1.5M-€3M,Pre-Seed / Seed,https://www.linkedin.com/company/j12-ventures-ab/,[email protected],SE
Industrifonden,https://www.eu-startups.com/investor/industrifonden/,"They invest in early-stage companies from seed to A-round and sometimes earlier, with initial investments typically ranging from 10-50 million SEK. Their evergreen fund structure allows them to prioritize long-term value over short-term gains. They focus on unique, scalable innovations that can have a meaningful societal impact, led by passionate founders capable of driving industry-changing ideas to fruition.",VC Firm,Sweden,http://www.industrifonden.com,"Deep Tech, Life Sciences, Transformative Tech",€1.5M-€3M,Series A/B,http://www.linkedin.com/company/industrifonden,[email protected],SE
VNV Global,https://www.eu-startups.com/investor/vnv-global/,"VNV Global is an experienced and opportunistic investor known for backing business models with strong competitive advantages, particularly focusing on network effect businesses over the past decade. They provide patient capital to scalable tech companies worldwide, supporting mission-driven entrepreneurs tackling substantial challenges through innovative solutions. Based in Stockholm and Cyprus, VNV Global is publicly listed on NASDAQ Stockholm's Mid Cap segment under the ticker VNV.",VC Firm,Sweden,https://vnv.global,"Mobility, Marketplace, Digital Health, Classifieds",€1.5M-€3M,Series A/B,https://www.linkedin.com/company/vnv-global-ltd,[email protected],SE
Prima Materia,https://www.eu-startups.com/investor/prima-materia/,"They aim to partner with exceptional individuals to build technology-driven companies that solve important societal problems. Acting as active owners rather than mere investors, they focus on a small number of enterprises for long-term success. Their philosophy emphasizes Europe's ability to attract top talent globally and their commitment to fostering companies that lead in critical areas of societal impact. Founder is Daniel Ek, Founder and Chairman of Spotify.",VC Firm,Sweden,https://primamateria.com/,Deep Tech,Above €3M,Series A/B,https://www.linkedin.com/company/primamateria/,[email protected],SE
Trill Impact,https://www.eu-startups.com/investor/trill-impact/,"Trill Impact operates as a dedicated Impact House focused exclusively on impact investments. Their unique design ensures that all investments are aimed at generating positive returns while making significant impacts on people, the planet, and investors alike.",VC Firm,Sweden,https://www.trillimpact.com/,"Green Tech, Life Sciences, Impact Investing",Above €3M,"Pre-Seed / Seed, Series C & Beyond",https://www.linkedin.com/company/trill-impact/,[email protected],SE
SEB Venture Capital,https://www.eu-startups.com/investor/seb-venture-capital/,"SEB Venture Capital, a leading Fintech investor in the Nordics since 1995, aims to create sustainable, long-term value through strategic investments in innovative companies. They prioritize strong management teams and seek transformative technologies that enhance the financial industry's intelligence, safety, sustainability, and user experience. Their partnerships offer access to extensive international networks, specialized expertise, and robust financial resources within SEB.",VC Firm,Sweden,http://www.seb.se/venturecapital,"AI, machine learning, fintech",Above €3M,Series A/B,https://www.linkedin.com/company/seb-kort,[email protected],SE
HealthCap,https://www.eu-startups.com/investor/healthcap/,"HealthCap is a European venture capital firm investing globally in life sciences and has raised eight funds since 1996. HealthCap has backed and built more than 127 companies, taken more than 45 companies public, and completed numerous trade sales. The investment strategy focuses on diseases with a high unmet medical need and breakthrough therapies that have the potential to be transformative, change clinical practice, and change the lives of patients suffering from these conditions.",VC Firm,Sweden,https://www.healthcap.eu,"Life sciences, biotech, pharma",Above €3M,Series A/B,https://www.linkedin.com/company/healthcap,[email protected],SE
Schibsted,https://www.eu-startups.com/investor/schibsted/,"Schibsted Marketplaces, renowned for its leading brands in the Nordics, is reshaping consumer consumption patterns across goods and services. Recently, the company underwent a split into two distinct entities. Concerning the division, their business focuses on developing marketplaces within four primary sectors – Mobility, Recommerce, Real Estate, and Jobs – pivotal elements within the circular economy.",VC Firm,Sweden,http://www.schibsted.com,"Marketplaces, digital media",Above €3M,Series A/B,https://www.linkedin.com/company/schibsted-growth,[email protected],SE
BackingMinds,https://www.eu-startups.com/investor/backingminds/,"€50m Nordic pre-seed/seed fund, backing great underinvested entrepreneurs (€500K-€3m tickets). They champion an innovative approach to business, focusing on overlooked opportunities and backing high-performing founders beyond traditional venture capital networks. Their commitment to backing extends beyond financial support, emphasizing proactive engagement and collaborative partnerships with founders, characterized by genuine care and dedication.",VC Firm,Sweden,http://backingminds.com,"Green Tech, Sustainability, Impact, Diversity",€100k-€1.5M,Pre-Seed / Seed,https://www.linkedin.com/company/backingminds/,[email protected],SE
