name,link,description,investorType,hQLocation,website,investmentAreas,typicalInvestment,fundingStage,linkedin,contactEmail,country
Chromia Innovation Lab,https://www.eu-startups.com/investor/chromia-innovation-lab/,"Chromia Innovation Lab, the creators of the groundbreaking relational blockchain technology, has officially launched its second annual Incubation Program, designed to help blockchain entrepreneurs, developers, and designers bring their startup ideas to life on the Chromia platform. Chromia is a platform that is both a blockchain and a relational database, built with both developers and end-users in mind. Chromia by ChromaWay is a public relational blockchain platform powered by #Rell.",Accelerator,Sweden,https://innovationlab.chromia.com,"Blockchain technology, Financial Services, Gaming, Web3",0-€100k,Pre-Seed / Seed,https://www.linkedin.com/company/chromia,[email protected],SE
Arctic Business,https://www.eu-startups.com/investor/arctic-business/,"Arctic Business is a business incubator that assists startups and businesses with teams, funding, and growth. Arctic Business finds and expands extraordinary ideas into successful international businesses on an international market solving important problems. We connect founders with the right team, money, partners and customers.",Accelerator,Sweden,https://www.abi.se,"Incubation, Venture Capital, Financing, Innovation",0-€100k,Pre-Seed / Seed,https://www.linkedin.com/company/joinarcticbusiness/,[email protected],SE
Nxt2b,https://www.eu-startups.com/investor/nxt2b/,"NXT2B is a fully privately owned venture capital company capable of making fast investment decisions without requiring external capital. The NXT2B team has proven experience in commercializing innovative projects and partners with competent and ambitious entrepreneurs, focusing on growth equity investments in healthcare, medical devices, and specialty pharmaceutical companies. They are prepared to invest in early-phase projects of high scientific quality and reasonable business potential, as well as in technology and consumer companies with unique ideas. Since its inception in 2011, NXT2B has invested in over 30 companies, offering active support to portfolio management teams to build market-leading companies.",VC Firm,Sweden,http://www.nxt2b.com,"Healthcare, Medtech, Biotech, Diagnostics",€1.5M-€3M,Series A/B,,[email protected],SE
+Cap,https://www.eu-startups.com/investor/cap/,Impact Investment Company focusing on high-impact early-stage startups - Backing the world's most promising high-impact startups www.pluscap.se Investments include www.worldish.se and www.woshapp.se,VC Firm,Sweden,https://www.pluscap.se,"Sustainability, Healthtech, Sports Tech, Impact",€100k-€1.5M,Pre-Seed / Seed,https://www.linkedin.com/company/pluscapse/,[email protected],SE
Klimatet Invest,https://www.eu-startups.com/investor/klimatet-invest/,"Klimatet Invest invests early in companies in the Nordics with disruptive technologies that significantly contribute to a sustainable future. Its primary investment focus is on the energy system of the future, centering on wind, solar, hydrogen, and climate-smart energy storage. Klimatet Invest is headquartered in Gothenburg.",VC Firm,Sweden,https://www.klimatetinvest.se/,"Energy, Renewables, Green Hydrogen, Clean Tech",€100k-€1.5M,Pre-Seed / Seed,https://www.linkedin.com/company/klimatet-invest,[email protected],SE
All Generation Ventures,https://www.eu-startups.com/investor/all-generation-ventures/,"AGV (All Generation Ventures) is the Nordic PropTech platform connecting entrepreneurs, investors, and stakeholders. Its mission is to create the best environment for scaling Nordic PropTech companies. AGV's ecosystem acts as a link between PropTech startups and leading real estate companies, accelerating the digitalization of the Nordic real estate industry.",VC Firm,Sweden,http://www.agvnordics.se/,"PropTech, Circular Economy, Waste Management, Property Management",€100k-€1.5M,Pre-Seed / Seed,https://www.linkedin.com/company/all-generation-ventures,[email protected],SE
Tigrim,https://www.eu-startups.com/investor/tigrim/,"Tigrim is a statement, a feeling and a sense of belonging. We believe in people and their visions, helping them grow into sustainable companies. We focus on people and the bright ideas that power our future.",VC Firm,Sweden,https://www.tigrim.com/,"Gaming, Rental, Software",€100k-€1.5M,Series A/B,https://www.linkedin.com/company/tigrim/,[email protected],SE
Ocean Impact,https://www.eu-startups.com/investor/ocean-impact/,"Founded on a passion for the oceans and a commitment to making a difference, Ocean Impact is the Sweden-based investment firm of Fredrik Lind and Robin Ramm-Ericson. Ocean Impact aspires to support entrepreneurs and promising tech companies to fulfill their vision. Fredrik brings 25 years of experience serving technology companies and private equity investors as Senior Partner first at McKinsey & Co. in Singapore, and then at BCG in Stockholm, where he also led ocean policy and sustainability work as areas of expertise. The entrepreneur and unicorn-builder Robin leverages a deep passion for tech and ocean with his experience in actively building tech companies from the first idea to IPO and beyond. As an active owner and partner, Ocean Impact invests in and supports the scaling of tech companies with ocean impact.",VC Firm,Sweden,https://www.oceanimpact.com/,"Ocean Tech, Marine Technology, Aquaculture",€100k-€1.5M,Pre-Seed / Seed,https://www.linkedin.com/company/oceanimpact/,[email protected],SE
20 North Street,https://www.eu-startups.com/investor/20-north-street/,"We focus on healthcare companies within pharma, biotech, medical technology and health care services and; technology companies within software and hardware. We are primarily interested when the capital and competence we add are required for product or market development. We make investments in companies which are still small and where we can make a difference as owners. We invest in several rounds of financing but limit our initial investment to SEK 10 million. We are looking for a high return which typically is achieved through and exit within 3-5 years. Our investors make a difference for the companies we invest in through the board.",VC Firm,Sweden,http://20northstreet.se/,"Healthcare companies within pharma, biotech, medical technology and health care services and; technology companies within software and hardware.",€100k-€1.5M,Pre-Seed / Seed,,[email protected],SE
Cryptowell,https://www.eu-startups.com/investor/cryptowell/,"Cryptowell invests in companies, startups, and projects related to fintech and blockchain technology. Based in Stockholm, Sweden, Cryptowell is an atypical venture capital firm that emerged from the craft of mining Litecoin. Its investment philosophy is to invest in people and companies that share its view, belief, and passion for blockchain technology.",VC Firm,Sweden,https://cryptowell.se/,"Fintech, blockchain, Web3",€100k-€1.5M,Pre-Seed / Seed,,[email protected],SE
Enexis AB,https://www.eu-startups.com/investor/enexis-ab/,"Enexis AB invest in companies involved in plant-based medical, wellness and industrial applications, notably cannabis and hemp. They invest in companies that aim to improve lives of millions of people while delivering financial returns for the investors.",VC Firm,Sweden,https://www.enexis.se/,"Medical cannabis, CBD, Industrial Hemp",€1.5M-€3M,Pre-Seed / Seed,https://www.linkedin.com/company/enexis-ab,[email protected],SE
Aligned,https://www.eu-startups.com/investor/aligned/,"Aligned invests from the pre-seed/seed stage through early growth stages, without focusing on any specific sectors. The firm brings meaningful investment experience, a diverse support network, and a committed partnership to enable founders of all kinds to realize their vision.",VC Firm,Sweden,https://alignedvc.se,"AI, Software, Music",€100k-€1.5M,Pre-Seed / Seed,https://www.linkedin.com/company/alignedvc,[email protected],SE
Walerud Ventures,https://www.eu-startups.com/investor/walerud-ventures/,"Walerud Ventures joins pre-seed and seed stage companies as investors, advisors and part-time employees. Deep tech that is planet-positive. Nordic, deep tech, pre-seed projects for the living planet",VC Firm,Sweden,http://www.walerud.com,"Nordic, deep tech, green tech, sustainability, fintech, AI",€100k-€1.5M,Pre-Seed / Seed,https://www.linkedin.com/company/walerud-ventures,[email protected],SE
Northislet,https://www.eu-startups.com/investor/northislet/,"The Nordic region is at the forefront of the technology and scientific revolution. Northislet's vision is to help create and build Nordic champions within Life Science, allowing them to grow and reach their potential in the hands of local entrepreneurs, employees, and shareholders. Their goal is to create long-term value for all stakeholders, fostering a prosperous environment for new and existing companies, entrepreneurs, and scientists, making the Nordic region a competitive and attractive place for global talent within Life Science. Northislet aims to become a leading Nordic investment company in Life Science over the next 25 years, with the journey just beginning.",VC Firm,Sweden,http://www.northislet.com,"Life Sciences, Pharma, Biotech, MedTech",Above €3M,Series C & Beyond,https://www.linkedin.com/company/northislet/about/,[email protected],SE
Red Pill VC,https://www.eu-startups.com/investor/red-pill-vc/,"Red Pill Invest is a boutique venture capital firm based in Stockholm. We invest in awesome companies and proudly support founders in accelerating growth. Our focus areas are Tech and Health Care. Together with our investor network, we provide more than just capital. We provide smart capital.",VC Firm,Sweden,http://www.northislet.com,"Healthcare, Cleantech, Fintech, and Femtech",€100k-€1.5M,Pre-Seed / Seed,https://www.linkedin.com/company/red-pill-invest-ab/,[email protected],SE
Immetric,https://www.eu-startups.com/investor/immetric/,"ImImmetric Invest is a boutique investment fund specializing in high-potential deep tech startups in Europe. They prioritize the importance of patents and patent strategy in building successful companies. Through hands-on operational involvement, Immetric Invest develops tailored, data-driven IP strategies for their portfolio companies, aiming to enhance success rates and maximize shareholder value from foundation to IPO.",VC Firm,Sweden,https://www.immetric.com,"Deep Tech, Automotive, Manufacturing, Health Diagnostics",€100k-€1.5M,Pre-Seed / Seed,https://www.linkedin.com/company/immetric,[email protected],SE
Devotion Ventures,https://www.eu-startups.com/investor/devotion-ventures/,"Devotion Ventures is a micro VC fund focused on supporting and investing in early-stage B2B SaaS companies led by courageous entrepreneurs driven to make a significant impact globally. Founded by the creators of Minna Technologies and Adfenix, Devotion Ventures brings firsthand experience in scaling operational teams to over 100 employees and achieving annual revenues exceeding 100 MSEK across more than 10 markets. The fund is bolstered by the support of prominent backers like Alexander Hars, Magnus Emilsson, and Kim Olsson. Devotion Ventures has already made impactful investments in companies such as HomeQ, AllaBRF, Stockrepublic, and Näktergal, positioning itself at the forefront of nurturing transformative startups.",VC Firm,Sweden,https://www.devotionventures.com/,"Impact Investing, Fintech, PropTech",€100k-€1.5M,Series A/B,https://www.linkedin.com/company/devotion-ventures/,[email protected],SE
Carl Westin,https://www.eu-startups.com/investor/carl-westin/,Carl Westin is an international investment company. They invest in great people with big ideas. Industry agnostic-,VC Firm,Sweden,http://carlwestin.com,"Healthtech, Wellness, Software",€100k-€1.5M,Pre-Seed / Seed,https://www.linkedin.com/company/carl-westin/?originalSubdomain=ca,[email protected],SE
Njord Ventures,https://www.eu-startups.com/investor/njord-ventures/,"Njord Ventures is a seed and early-stage venture capital investor specializing in Swedish entrepreneurial companies. The firm seeks out inspirational entrepreneurs with scalable business models that demonstrate exceptional growth potential driven by technology, macro trends, and disruptions. Njord Ventures prioritizes investing in exceptional individuals who exhibit the determination to achieve extraordinary results.",VC Firm,Sweden,https://www.njordventures.se,"Gaming, Software, Fintech, Financial Services",€100k-€1.5M,Pre-Seed / Seed,https://www.linkedin.com/company/njord-ventures,[email protected],SE
Nordic Game Ventures,https://www.eu-startups.com/investor/nordic-game-ventures/,"Nordic Game Ventures specializes in investing exclusively in early-stage game development and games ecosystem SME companies across the Nordic region (Denmark, Finland, Iceland, Norway, and Sweden). The firm focuses on companies that demonstrate outstanding team competence, exceptional content, and a robust market approach. Their portfolio strategy emphasizes diversification and balance, supporting startups through to follow-on investments across various subsectors. Nordic Game Ventures adopts a disciplined, no-leverage approach to fund composition and risk management. As a local, sector-specific expert, Nordic Game Ventures serves as a super-connector and co-investor with a vested interest in the Nordic games industry, making it an attractive partner for global investors seeking opportunities in this dynamic sector.",VC Firm,Sweden,http://nordicgameventures.com,"Gaming, Game Development, Game Studio",€100k-€1.5M,Pre-Seed / Seed,https://www.linkedin.com/company/nordic-game-ventures,[email protected],SE
Norrsken Launcher,https://www.eu-startups.com/investor/norrsken-launcher/,"Rooted in the Norrsken Foundation, the fund is an early-stage deep tech impact (Article 9) investor that offers access to impact capital, world-class recruitment resources, and scalable growth structures. With a focused strategy, the fund makes 1-3 selective investments per year and takes a deeply operational approach, working closely alongside founders to drive growth and achieve impactful outcomes.",VC Firm,Sweden,https://www.norrsken.org/launcher,"Deep Tech, Impact, GreenTech, CleanTech, AgTech",€1.5M-€3M,Pre-Seed / Seed,https://www.linkedin.com/company/norrsken-launcher/,[email protected],SE
Halland Invest,https://www.eu-startups.com/investor/halland-invest/,"The investment firm focuses on early-stage and growth-oriented companies located primarily within the region. They seek businesses with scalable ideas and clear competitive advantages, led by driven entrepreneurs willing to take significant risks. Emphasizing sustainability, they assess teams based on their diverse skills and experience. Investments are made through equity, convertible debentures, or Crown loans, with a preference for initiatives linked to growth in Halland and collaborations with Halmstad University. Initial investments typically start at SEK 500,000, with a maximum amount per company limited to one additional investment. Crown loans are offered up to SEK 500,000 annually per company, capped at SEK 250,000. Their investment strategy includes planning for potential exits within a six-year timeframe.",VC Firm,Sweden,https://hallandinvest.se/,"Medtech, Cybersecurity, Manufacturing, Healthtech",0-€100k,Pre-Seed / Seed,,[email protected],SE
Futurology Ventures,https://www.eu-startups.com/investor/futurology-ventures/,"Operational early stage investor Pre-seed to Series A. Focus on Climate Tech and Impact. Collaborating with VCs, Syndicates and Accelerators. We actively invest in Pre-Seed to Series A in passionate teams that are looking to scale. Focus on Nordic and Baltic impact and ClimateTech ideas.",VC Firm,Sweden,https://futurology.ventures/,"Climate Tech, Impact Investing, Sustainability, Circular Economy",€1.5M-€3M,Pre-Seed / Seed,https://www.linkedin.com/company/futurology-ventures,[email protected],SE
Crosslight Partners,https://www.eu-startups.com/investor/crosslight-partners/,"Crosslight Partners tackles substantial challenges within the food system with innovative solutions. These companies are at the early growth stage, demonstrating commercial traction. Investments typically range from SEK 1 to 10 million, with flexible ownership stakes. While the focus is global, emphasis lies on the Nordics and Europe. The investment horizon spans 3 to 7 years, and governance involvement includes securing a board seat or holding quarterly follow-up meetings.",VC Firm,Sweden,https://www.crosslightpartners.com/,"Life Sciences, Biotech, Alternative Proteins",€100k-€1.5M,Pre-Seed / Seed,https://www.linkedin.com/company/crosslight-partners/,[email protected],SE
Quinary Investment,https://www.eu-startups.com/investor/quinary-investment/,"Quinary Investment AB is a Stockholm-based investment company focused on long-term value creation through investments in both private and public technology companies, with a focus on B2B.",VC Firm,Sweden,https://www.quinary.se/,"B2B, Software, Deep Tech, Semiconductors",€100k-€1.5M,Pre-Seed / Seed,https://www.linkedin.com/company/quinary-investment,[email protected],SE
E14 Invest,https://www.eu-startups.com/investor/e14-invest/,"E14 Invest is a co-investment company based in Åre that invests in scalable growth companies with connections to the region along the European route E14, from Sundsvall to Trondheim. The goal is to favor entrepreneurship in the region while making long-term sustainable investments with good returns for our investors. We also make a smaller percentage of investments outside the region when it is particularly interesting.",VC Firm,Sweden,http://www.e14invest.se,"Healthtech, Wellness, Software",€100k-€1.5M,Pre-Seed / Seed,https://www.linkedin.com/company/e14-invest-ab/,[email protected],SE
Confidus Venture Capital,https://www.eu-startups.com/investor/confidus-venture-capital/,Confidus Venture Capital is a venture fund designed to outperform. It invests in future winners in digital transformation and automation.,VC Firm,Sweden,https://www.confidus.com/,"SaaS, ML, Blockchain",€1.5M-€3M,Pre-Seed / Seed,https://www.linkedin.com/company/confidus-venture-capital/,[email protected],SE
First Venture,https://www.eu-startups.com/investor/first-venture/,"First Venture invests in strong entrepreneurial teams in technology, health and sustainability. First Venture invests in both unlisted and listed growth companies with a market cap lower than SEK 500 million. The investor team led by Rune Nordlander and Peter Werme together has a long, relevant and unique experience of investing in both listed and unlisted companies in technology, health and sustainability. First Venture is a long-term, active owner and works closely with the entrepreneurial teams in the portfolio companies.",VC Firm,Sweden,https://first-venture.se,"Deep Tech, Semiconductor, Manufacturing, AI",€100k-€1.5M,Pre-Seed / Seed,https://www.linkedin.com/company/first-venture-sweden/,[email protected],SE
Beijer Ventures,https://www.eu-startups.com/investor/beijer-ventures/,"Confidus Venture Capital, part of the family-owned Beijer Holding, invests in digital transformation and automation. Beijer Holding also includes Beijerinvest and holds a controlling stake in Beijer Alma, an international component manufacturing and industrial trade group. Additionally, Beijer Holding supports various organizations focused on entrepreneurship, research, and education, such as the Anders Walls Foundation and the Beijer Institute. Confidus Venture Capital seeks companies with stable ownership, development progress, and strong entrepreneurial cultures to achieve significant growth.",VC Firm,Sweden,https://beijerventures.se,"Biotech, Healthtech, Diagnostics, Digital Health",€100k-€1.5M,Pre-Seed / Seed,https://www.linkedin.com/company/beijer-ventures,[email protected],SE
RP Ventures,https://www.eu-startups.com/investor/rp-ventures/,"""RP Ventures is a nordic seed and early stage investment company primarily focusing in the technology space. We add hands on management competences and financial resources to pursue growth and realise value. Examples of current and previous holdings include: Mestro AB (listed at Nasdaq First North) AAC Clyde Space AB (listed at Nasdaq First North) Rolling Optics AB (listed at Nasdaq First North) Byredo AB (sold to Manzanita Capital)""",VC Firm,Sweden,http://www.rpventures.se,"Software, Database, Cloud, Open Source",Above €3M,Series C & Beyond,https://www.linkedin.com/company/rp-ventures,[email protected],SE
Starbright Invest,https://www.eu-startups.com/investor/starbright-invest/,"Starbright Invest focuses on investing in entrepreneur-led, scalable companies with the potential for significant growth, particularly in technology and digital innovation that promotes sustainable development. We are actively committed to supporting our portfolio companies and aim for investments of €0.5-1.5 million.",VC Firm,Sweden,https://www.starbrightinvest.com/,"Sustainability, SaaS, Digital Marketplaces, IoT",€100k-€1.5M,Series A/B,https://www.linkedin.com/company/starbright-invest,[email protected],SE
Astrec Invest,https://www.eu-startups.com/investor/astrec-invest/,"They partner with entrepreneurs and scientists who challenge conventional thinking and tackle complex problems. Their focus is on investing in innovative solutions with the potential to disrupt market structures. They prioritize businesses that embody agility, scalability, and sustainability in their operations and growth strategies.",VC Firm,Sweden,http://www.astrecinvest.com,"Medtech, Healthtech, Biotech, Diagnostics",0-€100k,Pre-Seed / Seed,https://www.linkedin.com/company/astrec-invest,[email protected],SE
SEB Greentech Venture Capital,https://www.eu-startups.com/investor/seb-greentech-venture-capital/,"SEB Greentech Venture Capital specializes in green technology investments, targeting transformative ideas with significant potential to reduce greenhouse gas emissions or mitigate planetary boundary challenges. They focus on hardware, software, and technology platform solutions across sectors such as renewable energy, energy storage, water and agricultural technology, circular business models, and waste management.",VC Firm,Sweden,https://sebgroup.com/our-offering/financing-and-investment-banking/greentech,"Green Tech, Renewables, Energy Storage, AgTech",€1.5M-€3M,Series A/B,https://www.linkedin.com/company/seb,[email protected],SE
Ampli Ventures,https://www.eu-startups.com/investor/ampli-ventures/,"Ampli Ventures is a venture capital investment company focused on rapidly expanding SaaS companies in their early stages. They maintain a long-term investment horizon without mandated exit timelines. Their team is founder-friendly, boasting experience from prominent tech firms. They offer a network of SaaS founders and investors as valuable sparring partners. Additionally, they possess the capability to support growth beyond Series A with their extensive investor community connections.",VC Firm,Sweden,https://www.ampli.vc/,"SaaS, Software as a Service, Cloud",€100k-€1.5M,Series A/B,https://www.linkedin.com/company/ampliventures,[email protected],SE
Bonit Capital,https://www.eu-startups.com/investor/bonit-capital/,"Bonit Capital, a Swedish family-owned investment company, engages in diverse sectors and asset classes, including social investments and outcome models. In Venture Capital, Bonit focuses on life sciences, providing capital and industry expertise to ambitious founders in digital health, medical technology, and diagnostics.",VC Firm,Sweden,http://bonitcapital.com,"Life Sciences, Digital health, Medtech, Diagnostics",€1.5M-€3M,Pre-Seed / Seed,https://www.linkedin.com/company/bonit-capital/,[email protected],SE
MOOR,https://www.eu-startups.com/investor/moor/,"Based in Stockholm, Sweden, the firm's portfolio spans investments in both public and private companies. Specializing in digital innovation, they focus on transformative technologies with a global impact, particularly strengthening their presence in the Nordics. Their private equity investments are characterized by a long-term perspective, prioritizing support for invested teams without predefined exit horizons. They adopt an active ownership approach, leveraging the proven experience and track record of their senior team in entrepreneurial ventures and specialized industries. Partnering closely with portfolio companies, they collaborate to enhance business capabilities and drive sustainable growth.",VC Firm,Sweden,[email protected],"Software, 3D Tech, Adtech, Ecommerce",Above €3M,Series A/B,,[email protected],SE
Linc AB,https://www.eu-startups.com/investor/linc-ab/,"Linc invests in product oriented companies in the Nordic Life Science industry – primarily in pharmaceutical and medical technology companies. Their investments in drug development usually take place at an early stage, while investments in medical technology are made in more mature businesses.",VC Firm,Sweden,https://linc.se/,"Nordics, MedTech, Biotech, Pharma",€1.5M-€3M,Pre-Seed / Seed,https://www.linkedin.com/company/linc-ab/,[email protected],SE
